text;split_sentences
I think the best approach is to focus on great players The albums they ve recorded will introduce you to important composers for the guitar Seeking out recordings based on the composers alone will get you mixed results The trinity of historically important players from last century are Andre Segovia Julian Bream John Williams These guys have each released great recordings and you ve been recommended them many times over They are not however necessarily the best representatives of the genre Here s a more recent selection of great players all well worth a listen Manuel Barrueco Sean Shibe Kyuhee Park David Russel Sharon Isbin It would be a mistake to get into the old masters and never give new artists a listen In many respects they are technically superior and they certainly play a more varied repertoire;[('i', 'NONE'), ('think', 'NONE'), ('the', 'NONE'), ('best', 'NONE'), ('approach', 'NONE'), ('is', 'NONE'), ('to', 'NONE'), ('focus', 'NONE'), ('on', 'NONE'), ('great', 'NONE'), ('players', 'NONE'), ('the', 'NONE'), ('albums', 'NONE'), ('they', 'NONE'), ('ve', 'NONE'), ('recorded', 'NONE'), ('will', 'NONE'), ('introduce', 'NONE'), ('you', 'NONE'), ('to', 'NONE'), ('important', 'NONE'), ('composers', 'NONE'), ('for', 'NONE'), ('the', 'NONE'), ('guitar', 'INSTR'), ('seeking', 'NONE'), ('out', 'NONE'), ('recordings', 'NONE'), ('based', 'NONE'), ('on', 'NONE'), ('the', 'NONE'), ('composers', 'NONE'), ('alone', 'NONE'), ('will', 'NONE'), ('get', 'NONE'), ('you', 'NONE'), ('mixed', 'NONE'), ('results', 'NONE'), ('the', 'NONE'), ('trinity', 'NONE'), ('of', 'NONE'), ('historically', 'NONE'), ('important', 'NONE'), ('players', 'NONE'), ('from', 'NONE'), ('last', 'NONE'), ('century', 'NONE'), ('are', 'NONE'), ('andre', 'NONE'), ('segovia', 'NONE'), ('julian', 'NONE'), ('bream', 'NONE'), ('john', 'NONE'), ('williams', 'NONE'), ('these', 'NONE'), ('guys', 'NONE'), ('have', 'NONE'), ('each', 'NONE'), ('released', 'NONE'), ('great', 'NONE'), ('recordings', 'NONE'), ('and', 'NONE'), ('you', 'NONE'), ('ve', 'NONE'), ('been', 'NONE'), ('recommended', 'NONE'), ('them', 'NONE'), ('many', 'NONE'), ('times', 'NONE'), ('over', 'NONE'), ('they', 'NONE'), ('are', 'NONE'), ('not', 'NONE'), ('however', 'NONE'), ('necessarily', 'NONE'), ('the', 'NONE'), ('best', 'NONE'), ('representatives', 'NONE'), ('of', 'NONE'), ('the', 'NONE'), ('genre', 'NONE'), ('here', 'NONE'), ('s', 'NONE'), ('a', 'NONE'), ('more', 'NONE'), ('recent', 'NONE'), ('selection', 'NONE'), ('of', 'NONE'), ('great', 'NONE'), ('players', 'NONE'), ('all', 'NONE'), ('well', 'NONE'), ('worth', 'NONE'), ('a', 'NONE'), ('listen', 'NONE'), ('manuel', 'NONE'), ('barrueco', 'NONE'), ('sean', 'NONE'), ('shibe', 'NONE'), ('kyuhee', 'NONE'), ('park', 'NONE'), ('david', 'NONE'), ('russel', 'NONE'), ('sharon', 'NONE'), ('isbin', 'NONE'), ('it', 'NONE'), ('would', 'NONE'), ('be', 'NONE'), ('a', 'NONE'), ('mistake', 'NONE'), ('to', 'NONE'), ('get', 'NONE'), ('into', 'NONE'), ('the', 'NONE'), ('old', 'NONE'), ('masters', 'NONE'), ('and', 'NONE'), ('never', 'NONE'), ('give', 'NONE'), ('new', 'NONE'), ('artists', 'NONE'), ('a', 'NONE'), ('listen', 'NONE'), ('in', 'NONE'), ('many', 'NONE'), ('respects', 'NONE'), ('they', 'NONE'), ('are', 'NONE'), ('technically', 'NONE'), ('superior', 'NONE'), ('and', 'NONE'), ('they', 'NONE'), ('certainly', 'NONE'), ('play', 'NONE'), ('a', 'NONE'), ('more', 'NONE'), ('varied', 'NONE'), ('repertoire', 'NONE')]
Thx for all of your recommendations I m for sure going to go check out Bach s lute suite no 4 and all of the rest of those suites and then after that maybe some of Julian Bream s work;[('thx', 'NONE'), ('for', 'NONE'), ('all', 'NONE'), ('of', 'NONE'), ('your', 'NONE'), ('recommendations', 'NONE'), ('i', 'NONE'), ('m', 'NONE'), ('for', 'NONE'), ('sure', 'NONE'), ('going', 'NONE'), ('to', 'NONE'), ('go', 'NONE'), ('check', 'NONE'), ('out', 'NONE'), ('bach', 'NONE'), ('s', 'NONE'), ('lute', 'INSTR'), ('suite', 'NONE'), ('no', 'NONE'), ('4', 'NONE'), ('and', 'NONE'), ('all', 'NONE'), ('of', 'NONE'), ('the', 'NONE'), ('rest', 'NONE'), ('of', 'NONE'), ('those', 'NONE'), ('suites', 'NONE'), ('and', 'NONE'), ('then', 'NONE'), ('after', 'NONE'), ('that', 'NONE'), ('maybe', 'NONE'), ('some', 'NONE'), ('of', 'NONE'), ('julian', 'NONE'), ('bream', 'NONE'), ('s', 'NONE'), ('work', 'NONE')]
So how will this help me play Rockband or Guitar Hero Totally kidding;[('so', 'NONE'), ('how', 'NONE'), ('will', 'NONE'), ('this', 'NONE'), ('help', 'NONE'), ('me', 'NONE'), ('play', 'NONE'), ('rockband', 'NONE'), ('or', 'NONE'), ('guitar', 'INSTR'), ('hero', 'NONE'), ('totally', 'NONE'), ('kidding', 'NONE')]
Description ACOUSTIC GUITAR FOR LIL KEED GUNNA TYPE BEATS CLICK IN THE PICTURE FOR MORE LOOPS INFO;[('description', 'NONE'), ('acoustic guitar', 'INSTR'), ('for', 'NONE'), ('lil', 'NONE'), ('keed', 'NONE'), ('gunna', 'NONE'), ('type', 'NONE'), ('beats', 'NONE'), ('click', 'NONE'), ('in', 'NONE'), ('the', 'NONE'), ('picture', 'NONE'), ('for', 'NONE'), ('more', 'NONE'), ('loops', 'NONE'), ('info', 'NONE')]
This is pretty good It amazes me how many people buy shitty speakers or headsets to go with their frankly amazing PC builds Ive been hunting around for a half decent small Amp to power my 2x B W 686 s currently using a Sony 7 1 Amp but its massive and ive lost the remote and the Topping youve linked looks a decent budget option optical sw reasonable power Only have a cheap xonar sound card but it all helps to improve the sound quality I do some recording at home just bass guitar via Presonus audiobox and it helps to have some half decent sound thats not logitech speakers Would this amp be capable of powering B W 683 s I have a 7 1 set I dont use any more and its a shame to have these idling in my loft I suspect I d need something a bit better for the big ones Also Grado headphones are another reaonably priced headphone manufacturer that has great sound quality;[('this', 'NONE'), ('is', 'NONE'), ('pretty', 'NONE'), ('good', 'NONE'), ('it', 'NONE'), ('amazes', 'NONE'), ('me', 'NONE'), ('how', 'NONE'), ('many', 'NONE'), ('people', 'NONE'), ('buy', 'NONE'), ('shitty', 'NONE'), ('speakers', 'NONE'), ('or', 'NONE'), ('headsets', 'NONE'), ('to', 'NONE'), ('go', 'NONE'), ('with', 'NONE'), ('their', 'NONE'), ('frankly', 'NONE'), ('amazing', 'NONE'), ('pc', 'NONE'), ('builds', 'NONE'), ('ive', 'NONE'), ('been', 'NONE'), ('hunting', 'NONE'), ('around', 'NONE'), ('for', 'NONE'), ('a', 'NONE'), ('half', 'NONE'), ('decent', 'NONE'), ('small', 'NONE'), ('amp', 'NONE'), ('to', 'NONE'), ('power', 'NONE'), ('my', 'NONE'), ('2x', 'NONE'), ('b', 'NONE'), ('w', 'NONE'), ('686', 'NONE'), ('s', 'NONE'), ('currently', 'NONE'), ('using', 'NONE'), ('a', 'NONE'), ('sony', 'NONE'), ('7', 'NONE'), ('1', 'NONE'), ('amp', 'NONE'), ('but', 'NONE'), ('its', 'NONE'), ('massive', 'NONE'), ('and', 'NONE'), ('ive', 'NONE'), ('lost', 'NONE'), ('the', 'NONE'), ('remote', 'NONE'), ('and', 'NONE'), ('the', 'NONE'), ('topping', 'NONE'), ('youve', 'NONE'), ('linked', 'NONE'), ('looks', 'NONE'), ('a', 'NONE'), ('decent', 'NONE'), ('budget', 'NONE'), ('option', 'NONE'), ('optical', 'NONE'), ('sw', 'NONE'), ('reasonable', 'NONE'), ('power', 'NONE'), ('only', 'NONE'), ('have', 'NONE'), ('a', 'NONE'), ('cheap', 'NONE'), ('xonar', 'NONE'), ('sound', 'NONE'), ('card', 'NONE'), ('but', 'NONE'), ('it', 'NONE'), ('all', 'NONE'), ('helps', 'NONE'), ('to', 'NONE'), ('improve', 'NONE'), ('the', 'NONE'), ('sound', 'NONE'), ('quality', 'NONE'), ('i', 'NONE'), ('do', 'NONE'), ('some', 'NONE'), ('recording', 'NONE'), ('at', 'NONE'), ('home', 'NONE'), ('just', 'NONE'), ('bass guitar', 'INSTR'), ('via', 'NONE'), ('presonus', 'NONE'), ('audiobox', 'NONE'), ('and', 'NONE'), ('it', 'NONE'), ('helps', 'NONE'), ('to', 'NONE'), ('have', 'NONE'), ('some', 'NONE'), ('half', 'NONE'), ('decent', 'NONE'), ('sound', 'NONE'), ('thats', 'NONE'), ('not', 'NONE'), ('logitech', 'NONE'), ('speakers', 'NONE'), ('would', 'NONE'), ('this', 'NONE'), ('amp', 'NONE'), ('be', 'NONE'), ('capable', 'NONE'), ('of', 'NONE'), ('powering', 'NONE'), ('b', 'NONE'), ('w', 'NONE'), ('683', 'NONE'), ('s', 'NONE'), ('i', 'NONE'), ('have', 'NONE'), ('a', 'NONE'), ('7', 'NONE'), ('1', 'NONE'), ('set', 'NONE'), ('i', 'NONE'), ('dont', 'NONE'), ('use', 'NONE'), ('any', 'NONE'), ('more', 'NONE'), ('and', 'NONE'), ('its', 'NONE'), ('a', 'NONE'), ('shame', 'NONE'), ('to', 'NONE'), ('have', 'NONE'), ('these', 'NONE'), ('idling', 'NONE'), ('in', 'NONE'), ('my', 'NONE'), ('loft', 'NONE'), ('i', 'NONE'), ('suspect', 'NONE'), ('i', 'NONE'), ('d', 'NONE'), ('need', 'NONE'), ('something', 'NONE'), ('a', 'NONE'), ('bit', 'NONE'), ('better', 'NONE'), ('for', 'NONE'), ('the', 'NONE'), ('big', 'NONE'), ('ones', 'NONE'), ('also', 'NONE'), ('grado', 'NONE'), ('headphones', 'NONE'), ('are', 'NONE'), ('another', 'NONE'), ('reaonably', 'NONE'), ('priced', 'NONE'), ('headphone', 'NONE'), ('manufacturer', 'NONE'), ('that', 'NONE'), ('has', 'NONE'), ('great', 'NONE'), ('sound', 'NONE'), ('quality', 'NONE')]
I think a piano might blow your mind;[('i', 'NONE'), ('think', 'NONE'), ('a', 'NONE'), ('piano', 'INSTR'), ('might', 'NONE'), ('blow', 'NONE'), ('your', 'NONE'), ('mind', 'NONE')]
You seem to know your stuff So I have a Native Instruments Komplete Audio 6 as my external sound card which I use to play guitar in my computer However I only use it when playing should I always have it plugged in and set as my default audio output I ve had issues before where while listening to music and playing at the same time audio will start popping eventually Great post btw;[('you', 'NONE'), ('seem', 'NONE'), ('to', 'NONE'), ('know', 'NONE'), ('your', 'NONE'), ('stuff', 'NONE'), ('so', 'NONE'), ('i', 'NONE'), ('have', 'NONE'), ('a', 'NONE'), ('native', 'NONE'), ('instruments', 'NONE'), ('komplete', 'NONE'), ('audio', 'NONE'), ('6', 'NONE'), ('as', 'NONE'), ('my', 'NONE'), ('external', 'NONE'), ('sound', 'NONE'), ('card', 'NONE'), ('which', 'NONE'), ('i', 'NONE'), ('use', 'NONE'), ('to', 'NONE'), ('play', 'NONE'), ('guitar', 'INSTR'), ('in', 'NONE'), ('my', 'NONE'), ('computer', 'NONE'), ('however', 'NONE'), ('i', 'NONE'), ('only', 'NONE'), ('use', 'NONE'), ('it', 'NONE'), ('when', 'NONE'), ('playing', 'NONE'), ('should', 'NONE'), ('i', 'NONE'), ('always', 'NONE'), ('have', 'NONE'), ('it', 'NONE'), ('plugged', 'NONE'), ('in', 'NONE'), ('and', 'NONE'), ('set', 'NONE'), ('as', 'NONE'), ('my', 'NONE'), ('default', 'NONE'), ('audio', 'NONE'), ('output', 'NONE'), ('i', 'NONE'), ('ve', 'NONE'), ('had', 'NONE'), ('issues', 'NONE'), ('before', 'NONE'), ('where', 'NONE'), ('while', 'NONE'), ('listening', 'NONE'), ('to', 'NONE'), ('music', 'NONE'), ('and', 'NONE'), ('playing', 'NONE'), ('at', 'NONE'), ('the', 'NONE'), ('same', 'NONE'), ('time', 'NONE'), ('audio', 'NONE'), ('will', 'NONE'), ('start', 'NONE'), ('popping', 'NONE'), ('eventually', 'NONE'), ('great', 'NONE'), ('post', 'NONE'), ('btw', 'NONE')]
Maybe this is heretical but I think classical guitar music might actually be easier to play on this thing I found called the Harpejji;[('maybe', 'NONE'), ('this', 'NONE'), ('is', 'NONE'), ('heretical', 'NONE'), ('but', 'NONE'), ('i', 'NONE'), ('think', 'NONE'), ('classical guitar', 'INSTR'), ('music', 'NONE'), ('might', 'NONE'), ('actually', 'NONE'), ('be', 'NONE'), ('easier', 'NONE'), ('to', 'NONE'), ('play', 'NONE'), ('on', 'NONE'), ('this', 'NONE'), ('thing', 'NONE'), ('i', 'NONE'), ('found', 'NONE'), ('called', 'NONE'), ('the', 'NONE'), ('harpejji', 'INSTR')]
The Ave Maria is totally possible to play on a classical guitar more or less the same as the video but here s a super cool non-classical example from a more impressive player than the one in the video edit neither of the performers are me I just found the videos To play that on guitar you d almost certainly have to compromise the parts where he s playing at both ends of the range and if you could manage to play the rest I imagine there d be a lot more contortionism involved;[('the', 'NONE'), ('ave', 'NONE'), ('maria', 'NONE'), ('is', 'NONE'), ('totally', 'NONE'), ('possible', 'NONE'), ('to', 'NONE'), ('play', 'NONE'), ('on', 'NONE'), ('a', 'NONE'), ('classical guitar', 'INSTR'), ('more', 'NONE'), ('or', 'NONE'), ('less', 'NONE'), ('the', 'NONE'), ('same', 'NONE'), ('as', 'NONE'), ('the', 'NONE'), ('video', 'NONE'), ('but', 'NONE'), ('here', 'NONE'), ('s', 'NONE'), ('a', 'NONE'), ('super', 'NONE'), ('cool', 'NONE'), ('non-classical', 'NONE'), ('example', 'NONE'), ('from', 'NONE'), ('a', 'NONE'), ('more', 'NONE'), ('impressive', 'NONE'), ('player', 'NONE'), ('than', 'NONE'), ('the', 'NONE'), ('one', 'NONE'), ('in', 'NONE'), ('the', 'NONE'), ('video', 'NONE'), ('edit', 'NONE'), ('neither', 'NONE'), ('of', 'NONE'), ('the', 'NONE'), ('performers', 'NONE'), ('are', 'NONE'), ('me', 'NONE'), ('i', 'NONE'), ('just', 'NONE'), ('found', 'NONE'), ('the', 'NONE'), ('videos', 'NONE'), ('to', 'NONE'), ('play', 'NONE'), ('that', 'NONE'), ('on', 'NONE'), ('guitar', 'INSTR'), ('you', 'NONE'), ('d', 'NONE'), ('almost', 'NONE'), ('certainly', 'NONE'), ('have', 'NONE'), ('to', 'NONE'), ('compromise', 'NONE'), ('the', 'NONE'), ('parts', 'NONE'), ('where', 'NONE'), ('he', 'NONE'), ('s', 'NONE'), ('playing', 'NONE'), ('at', 'NONE'), ('both', 'NONE'), ('ends', 'NONE'), ('of', 'NONE'), ('the', 'NONE'), ('range', 'NONE'), ('and', 'NONE'), ('if', 'NONE'), ('you', 'NONE'), ('could', 'NONE'), ('manage', 'NONE'), ('to', 'NONE'), ('play', 'NONE'), ('the', 'NONE'), ('rest', 'NONE'), ('i', 'NONE'), ('imagine', 'NONE'), ('there', 'NONE'), ('d', 'NONE'), ('be', 'NONE'), ('a', 'NONE'), ('lot', 'NONE'), ('more', 'NONE'), ('contortionism', 'NONE'), ('involved', 'NONE')]
Question about transposing a guitar part up and down just a couple of semitones but still making it sound good;[('question', 'NONE'), ('about', 'NONE'), ('transposing', 'NONE'), ('a', 'NONE'), ('guitar', 'INSTR'), ('part', 'NONE'), ('up', 'NONE'), ('and', 'NONE'), ('down', 'NONE'), ('just', 'NONE'), ('a', 'NONE'), ('couple', 'NONE'), ('of', 'NONE'), ('semitones', 'NONE'), ('but', 'NONE'), ('still', 'NONE'), ('making', 'NONE'), ('it', 'NONE'), ('sound', 'NONE'), ('good', 'NONE')]
TLOU2 inspired me to learn guitar Here s my progress of a certain song over the last few months;[('tlou2', 'NONE'), ('inspired', 'NONE'), ('me', 'NONE'), ('to', 'NONE'), ('learn', 'NONE'), ('guitar', 'INSTR'), ('here', 'NONE'), ('s', 'NONE'), ('my', 'NONE'), ('progress', 'NONE'), ('of', 'NONE'), ('a', 'NONE'), ('certain', 'NONE'), ('song', 'NONE'), ('over', 'NONE'), ('the', 'NONE'), ('last', 'NONE'), ('few', 'NONE'), ('months', 'NONE')]
Same I played 1st part and the DLC in May and the 2nd part in June actually i watched it on YT lol I decided to learn to play the electric guitar a month later Who says games are useless;[('same', 'NONE'), ('i', 'NONE'), ('played', 'NONE'), ('1st', 'NONE'), ('part', 'NONE'), ('and', 'NONE'), ('the', 'NONE'), ('dlc', 'NONE'), ('in', 'NONE'), ('may', 'NONE'), ('and', 'NONE'), ('the', 'NONE'), ('2nd', 'NONE'), ('part', 'NONE'), ('in', 'NONE'), ('june', 'NONE'), ('actually', 'NONE'), ('i', 'NONE'), ('watched', 'NONE'), ('it', 'NONE'), ('on', 'NONE'), ('yt', 'NONE'), ('lol', 'NONE'), ('i', 'NONE'), ('decided', 'NONE'), ('to', 'NONE'), ('learn', 'NONE'), ('to', 'NONE'), ('play', 'NONE'), ('the', 'NONE'), ('electric guitar', 'INSTR'), ('a', 'NONE'), ('month', 'NONE'), ('later', 'NONE'), ('who', 'NONE'), ('says', 'NONE'), ('games', 'NONE'), ('are', 'NONE'), ('useless', 'NONE')]
You re giving me back the inspiration to learn how to play the guitar I am a master procrastinator so;[('you', 'NONE'), ('re', 'NONE'), ('giving', 'NONE'), ('me', 'NONE'), ('back', 'NONE'), ('the', 'NONE'), ('inspiration', 'NONE'), ('to', 'NONE'), ('learn', 'NONE'), ('how', 'NONE'), ('to', 'NONE'), ('play', 'NONE'), ('the', 'NONE'), ('guitar', 'INSTR'), ('i', 'NONE'), ('am', 'NONE'), ('a', 'NONE'), ('master', 'NONE'), ('procrastinator', 'NONE'), ('so', 'NONE')]
Description Clean Spanish Guitar DM me for full loop collabs Share what you ve made;[('description', 'NONE'), ('clean', 'NONE'), ('spanish', 'NONE'), ('guitar', 'INSTR'), ('dm', 'NONE'), ('me', 'NONE'), ('for', 'NONE'), ('full', 'NONE'), ('loop', 'NONE'), ('collabs', 'NONE'), ('share', 'NONE'), ('what', 'NONE'), ('you', 'NONE'), ('ve', 'NONE'), ('made', 'NONE')]
I saw this video that explains how the pianos don 2019t sound their best until you edit the velocity curves Check that out to see if it makes it even better for you I loved the idea of the MODX when it was announced I played one in person and while the UI wasn 2019t bad I didn 2019t love it though that 2019s probably due to needing to spend more time with it The keybed i thought was just ok Although I really love the price point so I can 2019t complain Overall i think i want to get one at some point Seems like a great gigging instrument with the montage sound set and a lighter weight;[('i', 'NONE'), ('saw', 'NONE'), ('this', 'NONE'), ('video', 'NONE'), ('that', 'NONE'), ('explains', 'NONE'), ('how', 'NONE'), ('the', 'NONE'), ('pianos', 'INSTR'), ('don', 'NONE'), ('2019t', 'NONE'), ('sound', 'NONE'), ('their', 'NONE'), ('best', 'NONE'), ('until', 'NONE'), ('you', 'NONE'), ('edit', 'NONE'), ('the', 'NONE'), ('velocity', 'NONE'), ('curves', 'NONE'), ('check', 'NONE'), ('that', 'NONE'), ('out', 'NONE'), ('to', 'NONE'), ('see', 'NONE'), ('if', 'NONE'), ('it', 'NONE'), ('makes', 'NONE'), ('it', 'NONE'), ('even', 'NONE'), ('better', 'NONE'), ('for', 'NONE'), ('you', 'NONE'), ('i', 'NONE'), ('loved', 'NONE'), ('the', 'NONE'), ('idea', 'NONE'), ('of', 'NONE'), ('the', 'NONE'), ('modx', 'NONE'), ('when', 'NONE'), ('it', 'NONE'), ('was', 'NONE'), ('announced', 'NONE'), ('i', 'NONE'), ('played', 'NONE'), ('one', 'NONE'), ('in', 'NONE'), ('person', 'NONE'), ('and', 'NONE'), ('while', 'NONE'), ('the', 'NONE'), ('ui', 'NONE'), ('wasn', 'NONE'), ('2019t', 'NONE'), ('bad', 'NONE'), ('i', 'NONE'), ('didn', 'NONE'), ('2019t', 'NONE'), ('love', 'NONE'), ('it', 'NONE'), ('though', 'NONE'), ('that', 'NONE'), ('2019s', 'NONE'), ('probably', 'NONE'), ('due', 'NONE'), ('to', 'NONE'), ('needing', 'NONE'), ('to', 'NONE'), ('spend', 'NONE'), ('more', 'NONE'), ('time', 'NONE'), ('with', 'NONE'), ('it', 'NONE'), ('the', 'NONE'), ('keybed', 'NONE'), ('i', 'NONE'), ('thought', 'NONE'), ('was', 'NONE'), ('just', 'NONE'), ('ok', 'NONE'), ('although', 'NONE'), ('i', 'NONE'), ('really', 'NONE'), ('love', 'NONE'), ('the', 'NONE'), ('price', 'NONE'), ('point', 'NONE'), ('so', 'NONE'), ('i', 'NONE'), ('can', 'NONE'), ('2019t', 'NONE'), ('complain', 'NONE'), ('overall', 'NONE'), ('i', 'NONE'), ('think', 'NONE'), ('i', 'NONE'), ('want', 'NONE'), ('to', 'NONE'), ('get', 'NONE'), ('one', 'NONE'), ('at', 'NONE'), ('some', 'NONE'), ('point', 'NONE'), ('seems', 'NONE'), ('like', 'NONE'), ('a', 'NONE'), ('great', 'NONE'), ('gigging', 'NONE'), ('instrument', 'NONE'), ('with', 'NONE'), ('the', 'NONE'), ('montage', 'NONE'), ('sound', 'NONE'), ('set', 'NONE'), ('and', 'NONE'), ('a', 'NONE'), ('lighter', 'NONE'), ('weight', 'NONE')]
Sure There are some chord voicings that may use it and it s especially useful if you leave for example the two highest strings open on a guitar and move a chord shape up and down - those open strings make the chords sound connected Also unison bends are a common technique used in rock music;[('sure', 'NONE'), ('there', 'NONE'), ('are', 'NONE'), ('some', 'NONE'), ('chord', 'NONE'), ('voicings', 'NONE'), ('that', 'NONE'), ('may', 'NONE'), ('use', 'NONE'), ('it', 'NONE'), ('and', 'NONE'), ('it', 'NONE'), ('s', 'NONE'), ('especially', 'NONE'), ('useful', 'NONE'), ('if', 'NONE'), ('you', 'NONE'), ('leave', 'NONE'), ('for', 'NONE'), ('example', 'NONE'), ('the', 'NONE'), ('two', 'NONE'), ('highest', 'NONE'), ('strings', 'NONE'), ('open', 'NONE'), ('on', 'NONE'), ('a', 'NONE'), ('guitar', 'INSTR'), ('and', 'NONE'), ('move', 'NONE'), ('a', 'NONE'), ('chord', 'NONE'), ('shape', 'NONE'), ('up', 'NONE'), ('and', 'NONE'), ('down', 'NONE'), ('-', 'NONE'), ('those', 'NONE'), ('open', 'NONE'), ('strings', 'NONE'), ('make', 'NONE'), ('the', 'NONE'), ('chords', 'NONE'), ('sound', 'NONE'), ('connected', 'NONE'), ('also', 'NONE'), ('unison', 'NONE'), ('bends', 'NONE'), ('are', 'NONE'), ('a', 'NONE'), ('common', 'NONE'), ('technique', 'NONE'), ('used', 'NONE'), ('in', 'NONE'), ('rock', 'NONE'), ('music', 'NONE')]
For string instruments that would help with efficient with certain passages and convenience for different chord voicings Saxophones and some other wind instruments do a thing called timbral trills usually in jazz where we repeat the same note with either an alternate fingering or different embouchure to alter the timbre of the note For guitar I suppose playing the same note on different strings could emulate this effect although I would think that the difference in timbre wouldn t be as drastic;[('for', 'NONE'), ('string', 'NONE'), ('instruments', 'NONE'), ('that', 'NONE'), ('would', 'NONE'), ('help', 'NONE'), ('with', 'NONE'), ('efficient', 'NONE'), ('with', 'NONE'), ('certain', 'NONE'), ('passages', 'NONE'), ('and', 'NONE'), ('convenience', 'NONE'), ('for', 'NONE'), ('different', 'NONE'), ('chord', 'NONE'), ('voicings', 'NONE'), ('saxophones', 'INSTR'), ('and', 'NONE'), ('some', 'NONE'), ('other', 'NONE'), ('wind', 'NONE'), ('instruments', 'NONE'), ('do', 'NONE'), ('a', 'NONE'), ('thing', 'NONE'), ('called', 'NONE'), ('timbral', 'NONE'), ('trills', 'NONE'), ('usually', 'NONE'), ('in', 'NONE'), ('jazz', 'NONE'), ('where', 'NONE'), ('we', 'NONE'), ('repeat', 'NONE'), ('the', 'NONE'), ('same', 'NONE'), ('note', 'NONE'), ('with', 'NONE'), ('either', 'NONE'), ('an', 'NONE'), ('alternate', 'NONE'), ('fingering', 'NONE'), ('or', 'NONE'), ('different', 'NONE'), ('embouchure', 'NONE'), ('to', 'NONE'), ('alter', 'NONE'), ('the', 'NONE'), ('timbre', 'NONE'), ('of', 'NONE'), ('the', 'NONE'), ('note', 'NONE'), ('for', 'NONE'), ('guitar', 'INSTR'), ('i', 'NONE'), ('suppose', 'NONE'), ('playing', 'NONE'), ('the', 'NONE'), ('same', 'NONE'), ('note', 'NONE'), ('on', 'NONE'), ('different', 'NONE'), ('strings', 'NONE'), ('could', 'NONE'), ('emulate', 'NONE'), ('this', 'NONE'), ('effect', 'NONE'), ('although', 'NONE'), ('i', 'NONE'), ('would', 'NONE'), ('think', 'NONE'), ('that', 'NONE'), ('the', 'NONE'), ('difference', 'NONE'), ('in', 'NONE'), ('timbre', 'NONE'), ('wouldn', 'NONE'), ('t', 'NONE'), ('be', 'NONE'), ('as', 'NONE'), ('drastic', 'NONE')]
on violin and the whole family you can use it to play more efficiently comfortably for example if every note except one is all on the same string in a passage or halfway through the passage the notes get higher it s usually easier to just shift higher up on the string also on the highest string if you shift higher up then you practically have an extra fifth string;[('on', 'NONE'), ('violin', 'INSTR'), ('and', 'NONE'), ('the', 'NONE'), ('whole', 'NONE'), ('family', 'NONE'), ('you', 'NONE'), ('can', 'NONE'), ('use', 'NONE'), ('it', 'NONE'), ('to', 'NONE'), ('play', 'NONE'), ('more', 'NONE'), ('efficiently', 'NONE'), ('comfortably', 'NONE'), ('for', 'NONE'), ('example', 'NONE'), ('if', 'NONE'), ('every', 'NONE'), ('note', 'NONE'), ('except', 'NONE'), ('one', 'NONE'), ('is', 'NONE'), ('all', 'NONE'), ('on', 'NONE'), ('the', 'NONE'), ('same', 'NONE'), ('string', 'NONE'), ('in', 'NONE'), ('a', 'NONE'), ('passage', 'NONE'), ('or', 'NONE'), ('halfway', 'NONE'), ('through', 'NONE'), ('the', 'NONE'), ('passage', 'NONE'), ('the', 'NONE'), ('notes', 'NONE'), ('get', 'NONE'), ('higher', 'NONE'), ('it', 'NONE'), ('s', 'NONE'), ('usually', 'NONE'), ('easier', 'NONE'), ('to', 'NONE'), ('just', 'NONE'), ('shift', 'NONE'), ('higher', 'NONE'), ('up', 'NONE'), ('on', 'NONE'), ('the', 'NONE'), ('string', 'NONE'), ('also', 'NONE'), ('on', 'NONE'), ('the', 'NONE'), ('highest', 'NONE'), ('string', 'NONE'), ('if', 'NONE'), ('you', 'NONE'), ('shift', 'NONE'), ('higher', 'NONE'), ('up', 'NONE'), ('then', 'NONE'), ('you', 'NONE'), ('practically', 'NONE'), ('have', 'NONE'), ('an', 'NONE'), ('extra', 'NONE'), ('fifth', 'NONE'), ('string', 'NONE')]
King Crimson 2019s 201cStarless 201d check out what the guitar is doing after 4 27;[('king', 'NONE'), ('crimson', 'NONE'), ('2019s', 'NONE'), ('201cstarless', 'NONE'), ('201d', 'NONE'), ('check', 'NONE'), ('out', 'NONE'), ('what', 'NONE'), ('the', 'NONE'), ('guitar', 'INSTR'), ('is', 'NONE'), ('doing', 'NONE'), ('after', 'NONE'), ('4', 'NONE'), ('27', 'NONE')]
