text;split_sentences
Sigh In order to not be completely dismissive I guess I can see where you re coming from in that they are both higher pitched string instruments capable of vibrato and have a certain nasal quality But no not at all And sustain doesn t really have anything to do with timbre Bowed guitar on the other hand though I would say the timbre is more similar to that of a cello;[('sigh', 'NONE'), ('in', 'NONE'), ('order', 'NONE'), ('to', 'NONE'), ('not', 'NONE'), ('be', 'NONE'), ('completely', 'NONE'), ('dismissive', 'NONE'), ('i', 'NONE'), ('guess', 'NONE'), ('i', 'NONE'), ('can', 'NONE'), ('see', 'NONE'), ('where', 'NONE'), ('you', 'NONE'), ('re', 'NONE'), ('coming', 'NONE'), ('from', 'NONE'), ('in', 'NONE'), ('that', 'NONE'), ('they', 'NONE'), ('are', 'NONE'), ('both', 'NONE'), ('higher', 'NONE'), ('pitched', 'NONE'), ('string', 'NONE'), ('instruments', 'NONE'), ('capable', 'NONE'), ('of', 'NONE'), ('vibrato', 'NONE'), ('and', 'NONE'), ('have', 'NONE'), ('a', 'NONE'), ('certain', 'NONE'), ('nasal', 'QLTY'), ('quality', 'NONE'), ('but', 'NONE'), ('no', 'NONE'), ('not', 'NONE'), ('at', 'NONE'), ('all', 'NONE'), ('and', 'NONE'), ('sustain', 'NONE'), ('doesn', 'NONE'), ('t', 'NONE'), ('really', 'NONE'), ('have', 'NONE'), ('anything', 'NONE'), ('to', 'NONE'), ('do', 'NONE'), ('with', 'NONE'), ('timbre', 'NONE'), ('bowed', 'QLTY'), ('guitar', 'INSTR'), ('on', 'NONE'), ('the', 'NONE'), ('other', 'NONE'), ('hand', 'NONE'), ('though', 'NONE'), ('i', 'NONE'), ('would', 'NONE'), ('say', 'NONE'), ('the', 'NONE'), ('timbre', 'NONE'), ('is', 'NONE'), ('more', 'NONE'), ('similar', 'NONE'), ('to', 'NONE'), ('that', 'NONE'), ('of', 'NONE'), ('a', 'NONE'), ('cello', 'INSTR')]
Description PIANO WITH DELAYS N FILTERS FOR NBAYOUNGBOY LIL BABY TYPE BEATS CLICK IN THE PICTURE FOR MORE LOOPS INFO;[('description', 'NONE'), ('piano', 'INSTR'), ('with', 'NONE'), ('delays', 'QLTY'), ('n', 'NONE'), ('filters', 'NONE'), ('for', 'NONE'), ('nbayoungboy', 'NONE'), ('lil', 'NONE'), ('baby', 'NONE'), ('type', 'NONE'), ('beats', 'NONE'), ('click', 'NONE'), ('in', 'NONE'), ('the', 'NONE'), ('picture', 'NONE'), ('for', 'NONE'), ('more', 'NONE'), ('loops', 'NONE'), ('info', 'NONE')]
I would by all means avoid VariAudio For at least two reasons It really only works on monophonic parts one note at a time no chords or harmonies and when it analyzes the track to find harmonic content it always misses the little details in between the notes string fret noise transients or ends of notes breaths for vocals etc While these may seem nice to keep intact it really only creates weird jumps glitches in your sound Instead opt for the built in Pitch Shift processing I almost always use the algorithm Poly Complex Formant if I want a transparent pitch shift You could also try just Poly Complex which won t preserve your formant but may sound good IMHO the other algos are really only useful for saving some loading time they re faster or creating lo-fi sounds but your mileage may certainly vary Try the Musical algos and if it s a monophonic sound you could go for the Solo algos but I find treating each sound as Poly and Complex will work better as all real sounds have polyphonic overtones and are pretty complex;[('i', 'NONE'), ('would', 'NONE'), ('by', 'NONE'), ('all', 'NONE'), ('means', 'NONE'), ('avoid', 'NONE'), ('variaudio', 'NONE'), ('for', 'NONE'), ('at', 'NONE'), ('least', 'NONE'), ('two', 'NONE'), ('reasons', 'NONE'), ('it', 'NONE'), ('really', 'NONE'), ('only', 'NONE'), ('works', 'NONE'), ('on', 'NONE'), ('monophonic', 'NONE'), ('parts', 'NONE'), ('one', 'NONE'), ('note', 'NONE'), ('at', 'NONE'), ('a', 'NONE'), ('time', 'NONE'), ('no', 'NONE'), ('chords', 'NONE'), ('or', 'NONE'), ('harmonies', 'NONE'), ('and', 'NONE'), ('when', 'NONE'), ('it', 'NONE'), ('analyzes', 'NONE'), ('the', 'NONE'), ('track', 'NONE'), ('to', 'NONE'), ('find', 'NONE'), ('harmonic', 'NONE'), ('content', 'NONE'), ('it', 'NONE'), ('always', 'NONE'), ('misses', 'NONE'), ('the', 'NONE'), ('little', 'NONE'), ('details', 'NONE'), ('in', 'NONE'), ('between', 'NONE'), ('the', 'NONE'), ('notes', 'NONE'), ('string', 'NONE'), ('fret', 'NONE'), ('noise', 'NONE'), ('transients', 'NONE'), ('or', 'NONE'), ('ends', 'NONE'), ('of', 'NONE'), ('notes', 'NONE'), ('breaths', 'NONE'), ('for', 'NONE'), ('vocals', 'NONE'), ('etc', 'NONE'), ('while', 'NONE'), ('these', 'NONE'), ('may', 'NONE'), ('seem', 'NONE'), ('nice', 'NONE'), ('to', 'NONE'), ('keep', 'NONE'), ('intact', 'NONE'), ('it', 'NONE'), ('really', 'NONE'), ('only', 'NONE'), ('creates', 'NONE'), ('weird', 'NONE'), ('jumps', 'NONE'), ('glitches', 'NONE'), ('in', 'NONE'), ('your', 'NONE'), ('sound', 'NONE'), ('instead', 'NONE'), ('opt', 'NONE'), ('for', 'NONE'), ('the', 'NONE'), ('built', 'NONE'), ('in', 'NONE'), ('pitch shift', 'QLTY'), ('processing', 'NONE'), ('i', 'NONE'), ('almost', 'NONE'), ('always', 'NONE'), ('use', 'NONE'), ('the', 'NONE'), ('algorithm', 'NONE'), ('poly', 'NONE'), ('complex', 'NONE'), ('formant', 'NONE'), ('if', 'NONE'), ('i', 'NONE'), ('want', 'NONE'), ('a', 'NONE'), ('transparent', 'NONE'), ('pitch shift', 'QLTY'), ('you', 'NONE'), ('could', 'NONE'), ('also', 'NONE'), ('try', 'NONE'), ('just', 'NONE'), ('poly', 'NONE'), ('complex', 'NONE'), ('which', 'NONE'), ('won', 'NONE'), ('t', 'NONE'), ('preserve', 'NONE'), ('your', 'NONE'), ('formant', 'NONE'), ('but', 'NONE'), ('may', 'NONE'), ('sound', 'NONE'), ('good', 'NONE'), ('imho', 'NONE'), ('the', 'NONE'), ('other', 'NONE'), ('algos', 'NONE'), ('are', 'NONE'), ('really', 'NONE'), ('only', 'NONE'), ('useful', 'NONE'), ('for', 'NONE'), ('saving', 'NONE'), ('some', 'NONE'), ('loading', 'NONE'), ('time', 'NONE'), ('they', 'NONE'), ('re', 'NONE'), ('faster', 'NONE'), ('or', 'NONE'), ('creating', 'NONE'), ('lo-fi', 'NONE'), ('sounds', 'NONE'), ('but', 'NONE'), ('your', 'NONE'), ('mileage', 'NONE'), ('may', 'NONE'), ('certainly', 'NONE'), ('vary', 'NONE'), ('try', 'NONE'), ('the', 'NONE'), ('musical', 'NONE'), ('algos', 'NONE'), ('and', 'NONE'), ('if', 'NONE'), ('it', 'NONE'), ('s', 'NONE'), ('a', 'NONE'), ('monophonic', 'NONE'), ('sound', 'NONE'), ('you', 'NONE'), ('could', 'NONE'), ('go', 'NONE'), ('for', 'NONE'), ('the', 'NONE'), ('solo', 'NONE'), ('algos', 'NONE'), ('but', 'NONE'), ('i', 'NONE'), ('find', 'NONE'), ('treating', 'NONE'), ('each', 'NONE'), ('sound', 'NONE'), ('as', 'NONE'), ('poly', 'NONE'), ('and', 'NONE'), ('complex', 'NONE'), ('will', 'NONE'), ('work', 'NONE'), ('better', 'NONE'), ('as', 'NONE'), ('all', 'NONE'), ('real', 'NONE'), ('sounds', 'NONE'), ('have', 'NONE'), ('polyphonic', 'NONE'), ('overtones', 'NONE'), ('and', 'NONE'), ('are', 'NONE'), ('pretty', 'NONE'), ('complex', 'NONE')]
I like to put some distortion or tube saturation on it;[('i', 'NONE'), ('like', 'NONE'), ('to', 'NONE'), ('put', 'NONE'), ('some', 'NONE'), ('distortion', 'QLTY'), ('or', 'NONE'), ('tube saturation', 'QLTY'), ('on', 'NONE'), ('it', 'NONE')]
When 23f0 a song d83c dfb6 d83c dfb5 d83c dfa4 is converted 21aa into MIDI d83c dd92 you d83d dc49 can still d83e dd1e d83d de4c hear d83d dc42 vocals d83d dde3 because of Timbre If you re playing d83c dfae guitar d83e dd20 d83c dfb8 when 23f0 you d83d dc48 pluck d83e dd0f one 261d d83d de4f d83c dffc of the strings d83c dfa3 it makes d83d dd95 a bunch d83c df7c of frequencies d83d dce1 The loudest is called d83d dcf2 the fundamental d83d dc91 which is the note d83d dcdd d83d dd75 d83d dd2d we hear d83d dc42 The others d83d dc6a are called d83d dcde overtones and while we don t d83d deab hear d83d dd0a d83d de49 them the overtones are what make d83d dd95 a violin d83d de02 sound d83d dc42 different d83d de21 from a piano d83c dfb9 for example d83d dcaa The overtones are what we call d83d dcde 260e an instrument s d83c dfb8 Timbre Since d83d dc68 a MIDI d83c dd92 is like d83d de04 d83e dd8a sheet d83d dc49 music d83c dfbc d83c dfb5 d83c dfb8 being read d83d dcd6 by a computer d83d dcbb when d83c df51 you d83d dc48 convert d83d debf d83e ddf9 d83c df2a an MP3 to MIDI d83c dd92 it doesn t just write d83d dcdd the fundamental d83d dc69 d83c dffd 200d 2696 fe0f 2728 pitch d83d de24 Pt d83d de33 d83d dc45 counts d83d dd22 any slight d83d dc4c changes d83d debc in pitch d83c dfa4 and volume d83d dc69 200d d83d dc69 200d d83d dc66 as new d83d dc4c notes d83d dcdd and also d83d dc68 writes 270d down 2b07 the overtones The human d83d dc64 voice d83d de03 d83d dd0a d83d dce2 also d83d dc68 has overtones so despite d83d deab the sound d83c df0b d83d dca5 d83d dd0a being a piano d83c dfb9 the default d83d de4a instrument d83c dfbb d83c dfba for most MIDI d83c dd92 DLSes the MIDI d83c dd92 is still d83e dd1e d83d de4c playing d83c dfbd the overtones so you d83d dc49 can still d83e dd1e d83d de4c hear d83d dc42 the voices d83d dd0a Also d83d dc68 MP3 is an audio file d83d dcc2 so the reason d83c df1f every d83d dcaf sound d83d dd0a is a piano d83c dfb9 is because it was as if every 261d d83c dffc sound d83d dc42 drums d83e dd41 and all d83d dcaf were being played d83c dfb2 in the same channel d83d dcfa d83d dce1 And since d83d dc68 drums d83e dd41 technically d83e dd4b d83e dd39 have pitch d83c dfa4 as well d83d de26 d83d dc40 d83e dd37 as overtones that s d83d de26 why d83e dd14 d83e dd37 you d83d dc48 hear d83d dc42 that low d83d dd09 horror d83d de31 sound d83d dd0a in a converted 21aa drum d83e dd41 MIDI d83c dd92 Note d83d dcd3 d83d dcda d83d dcd2 MIDI d83c dd92 technically d83d dd27 274c isn t an audio file d83d de0d as nothing 274c 274e has been recorded d83d dcf7 d83d dcf8 d83c dfa5 It s more like d83d dc4d sheet d83d decf music d83d dd0a d83c dfb5 d83c dfb6 in that it s a set d83d dcd0 of instructions 26a0 being read d83d dcd6 to a computer d83d dcbb i e d83c df6d d83c dd71 Play d83c dfbd this sound d83d dc42 at this pitch d83d deab d83d de46 d83c dffb at this time 23f0;[('when', 'NONE'), ('23f0', 'NONE'), ('a', 'NONE'), ('song', 'NONE'), ('d83c', 'NONE'), ('dfb6', 'NONE'), ('d83c', 'NONE'), ('dfb5', 'NONE'), ('d83c', 'NONE'), ('dfa4', 'NONE'), ('is', 'NONE'), ('converted', 'NONE'), ('21aa', 'NONE'), ('into', 'NONE'), ('midi', 'NONE'), ('d83c', 'NONE'), ('dd92', 'NONE'), ('you', 'NONE'), ('d83d', 'NONE'), ('dc49', 'NONE'), ('can', 'NONE'), ('still', 'NONE'), ('d83e', 'NONE'), ('dd1e', 'NONE'), ('d83d', 'NONE'), ('de4c', 'NONE'), ('hear', 'NONE'), ('d83d', 'NONE'), ('dc42', 'NONE'), ('vocals', 'NONE'), ('d83d', 'NONE'), ('dde3', 'NONE'), ('because', 'NONE'), ('of', 'NONE'), ('timbre', 'NONE'), ('if', 'NONE'), ('you', 'NONE'), ('re', 'NONE'), ('playing', 'NONE'), ('d83c', 'NONE'), ('dfae', 'NONE'), ('guitar', 'INSTR'), ('d83e', 'NONE'), ('dd20', 'NONE'), ('d83c', 'NONE'), ('dfb8', 'NONE'), ('when', 'NONE'), ('23f0', 'NONE'), ('you', 'NONE'), ('d83d', 'NONE'), ('dc48', 'NONE'), ('pluck', 'NONE'), ('d83e', 'NONE'), ('dd0f', 'NONE'), ('one', 'NONE'), ('261d', 'NONE'), ('d83d', 'NONE'), ('de4f', 'NONE'), ('d83c', 'NONE'), ('dffc', 'NONE'), ('of', 'NONE'), ('the', 'NONE'), ('strings', 'NONE'), ('d83c', 'NONE'), ('dfa3', 'NONE'), ('it', 'NONE'), ('makes', 'NONE'), ('d83d', 'NONE'), ('dd95', 'NONE'), ('a', 'NONE'), ('bunch', 'NONE'), ('d83c', 'NONE'), ('df7c', 'NONE'), ('of', 'NONE'), ('frequencies', 'NONE'), ('d83d', 'NONE'), ('dce1', 'NONE'), ('the', 'NONE'), ('loudest', 'NONE'), ('is', 'NONE'), ('called', 'NONE'), ('d83d', 'NONE'), ('dcf2', 'NONE'), ('the', 'NONE'), ('fundamental', 'NONE'), ('d83d', 'NONE'), ('dc91', 'NONE'), ('which', 'NONE'), ('is', 'NONE'), ('the', 'NONE'), ('note', 'NONE'), ('d83d', 'NONE'), ('dcdd', 'NONE'), ('d83d', 'NONE'), ('dd75', 'NONE'), ('d83d', 'NONE'), ('dd2d', 'NONE'), ('we', 'NONE'), ('hear', 'NONE'), ('d83d', 'NONE'), ('dc42', 'NONE'), ('the', 'NONE'), ('others', 'NONE'), ('d83d', 'NONE'), ('dc6a', 'NONE'), ('are', 'NONE'), ('called', 'NONE'), ('d83d', 'NONE'), ('dcde', 'NONE'), ('overtones', 'NONE'), ('and', 'NONE'), ('while', 'NONE'), ('we', 'NONE'), ('don', 'NONE'), ('t', 'NONE'), ('d83d', 'NONE'), ('deab', 'NONE'), ('hear', 'NONE'), ('d83d', 'NONE'), ('dd0a', 'NONE'), ('d83d', 'NONE'), ('de49', 'NONE'), ('them', 'NONE'), ('the', 'NONE'), ('overtones', 'NONE'), ('are', 'NONE'), ('what', 'NONE'), ('make', 'NONE'), ('d83d', 'NONE'), ('dd95', 'NONE'), ('a', 'NONE'), ('violin', 'INSTR'), ('d83d', 'NONE'), ('de02', 'NONE'), ('sound', 'NONE'), ('d83d', 'NONE'), ('dc42', 'NONE'), ('different', 'NONE'), ('d83d', 'NONE'), ('de21', 'NONE'), ('from', 'NONE'), ('a', 'NONE'), ('piano', 'INSTR'), ('d83c', 'NONE'), ('dfb9', 'NONE'), ('for', 'NONE'), ('example', 'NONE'), ('d83d', 'NONE'), ('dcaa', 'NONE'), ('the', 'NONE'), ('overtones', 'NONE'), ('are', 'NONE'), ('what', 'NONE'), ('we', 'NONE'), ('call', 'NONE'), ('d83d', 'NONE'), ('dcde', 'NONE'), ('260e', 'NONE'), ('an', 'NONE'), ('instrument', 'NONE'), ('s', 'NONE'), ('d83c', 'NONE'), ('dfb8', 'NONE'), ('timbre', 'NONE'), ('since', 'NONE'), ('d83d', 'NONE'), ('dc68', 'NONE'), ('a', 'NONE'), ('midi', 'NONE'), ('d83c', 'NONE'), ('dd92', 'NONE'), ('is', 'NONE'), ('like', 'NONE'), ('d83d', 'NONE'), ('de04', 'NONE'), ('d83e', 'NONE'), ('dd8a', 'NONE'), ('sheet', 'NONE'), ('d83d', 'NONE'), ('dc49', 'NONE'), ('music', 'NONE'), ('d83c', 'NONE'), ('dfbc', 'NONE'), ('d83c', 'NONE'), ('dfb5', 'NONE'), ('d83c', 'NONE'), ('dfb8', 'NONE'), ('being', 'NONE'), ('read', 'NONE'), ('d83d', 'NONE'), ('dcd6', 'NONE'), ('by', 'NONE'), ('a', 'NONE'), ('computer', 'NONE'), ('d83d', 'NONE'), ('dcbb', 'NONE'), ('when', 'NONE'), ('d83c', 'NONE'), ('df51', 'NONE'), ('you', 'NONE'), ('d83d', 'NONE'), ('dc48', 'NONE'), ('convert', 'NONE'), ('d83d', 'NONE'), ('debf', 'NONE'), ('d83e', 'NONE'), ('ddf9', 'NONE'), ('d83c', 'NONE'), ('df2a', 'NONE'), ('an', 'NONE'), ('mp3', 'NONE'), ('to', 'NONE'), ('midi', 'NONE'), ('d83c', 'NONE'), ('dd92', 'NONE'), ('it', 'NONE'), ('doesn', 'NONE'), ('t', 'NONE'), ('just', 'NONE'), ('write', 'NONE'), ('d83d', 'NONE'), ('dcdd', 'NONE'), ('the', 'NONE'), ('fundamental', 'NONE'), ('d83d', 'NONE'), ('dc69', 'NONE'), ('d83c', 'NONE'), ('dffd', 'NONE'), ('200d', 'NONE'), ('2696', 'NONE'), ('fe0f', 'NONE'), ('2728', 'NONE'), ('pitch', 'NONE'), ('d83d', 'NONE'), ('de24', 'NONE'), ('pt', 'NONE'), ('d83d', 'NONE'), ('de33', 'NONE'), ('d83d', 'NONE'), ('dc45', 'NONE'), ('counts', 'NONE'), ('d83d', 'NONE'), ('dd22', 'NONE'), ('any', 'NONE'), ('slight', 'NONE'), ('d83d', 'NONE'), ('dc4c', 'NONE'), ('changes', 'NONE'), ('d83d', 'NONE'), ('debc', 'NONE'), ('in', 'NONE'), ('pitch', 'NONE'), ('d83c', 'NONE'), ('dfa4', 'NONE'), ('and', 'NONE'), ('volume', 'NONE'), ('d83d', 'NONE'), ('dc69', 'NONE'), ('200d', 'NONE'), ('d83d', 'NONE'), ('dc69', 'NONE'), ('200d', 'NONE'), ('d83d', 'NONE'), ('dc66', 'NONE'), ('as', 'NONE'), ('new', 'NONE'), ('d83d', 'NONE'), ('dc4c', 'NONE'), ('notes', 'NONE'), ('d83d', 'NONE'), ('dcdd', 'NONE'), ('and', 'NONE'), ('also', 'NONE'), ('d83d', 'NONE'), ('dc68', 'NONE'), ('writes', 'NONE'), ('270d', 'NONE'), ('down', 'NONE'), ('2b07', 'NONE'), ('the', 'NONE'), ('overtones', 'NONE'), ('the', 'NONE'), ('human', 'NONE'), ('d83d', 'NONE'), ('dc64', 'NONE'), ('voice', 'NONE'), ('d83d', 'NONE'), ('de03', 'NONE'), ('d83d', 'NONE'), ('dd0a', 'NONE'), ('d83d', 'NONE'), ('dce2', 'NONE'), ('also', 'NONE'), ('d83d', 'NONE'), ('dc68', 'NONE'), ('has', 'NONE'), ('overtones', 'NONE'), ('so', 'NONE'), ('despite', 'NONE'), ('d83d', 'NONE'), ('deab', 'NONE'), ('the', 'NONE'), ('sound', 'NONE'), ('d83c', 'NONE'), ('df0b', 'NONE'), ('d83d', 'NONE'), ('dca5', 'NONE'), ('d83d', 'NONE'), ('dd0a', 'NONE'), ('being', 'NONE'), ('a', 'NONE'), ('piano', 'INSTR'), ('d83c', 'NONE'), ('dfb9', 'NONE'), ('the', 'NONE'), ('default', 'NONE'), ('d83d', 'NONE'), ('de4a', 'NONE'), ('instrument', 'NONE'), ('d83c', 'NONE'), ('dfbb', 'NONE'), ('d83c', 'NONE'), ('dfba', 'NONE'), ('for', 'NONE'), ('most', 'NONE'), ('midi', 'NONE'), ('d83c', 'NONE'), ('dd92', 'NONE'), ('dlses', 'NONE'), ('the', 'NONE'), ('midi', 'NONE'), ('d83c', 'NONE'), ('dd92', 'NONE'), ('is', 'NONE'), ('still', 'NONE'), ('d83e', 'NONE'), ('dd1e', 'NONE'), ('d83d', 'NONE'), ('de4c', 'NONE'), ('playing', 'NONE'), ('d83c', 'NONE'), ('dfbd', 'NONE'), ('the', 'NONE'), ('overtones', 'NONE'), ('so', 'NONE'), ('you', 'NONE'), ('d83d', 'NONE'), ('dc49', 'NONE'), ('can', 'NONE'), ('still', 'NONE'), ('d83e', 'NONE'), ('dd1e', 'NONE'), ('d83d', 'NONE'), ('de4c', 'NONE'), ('hear', 'NONE'), ('d83d', 'NONE'), ('dc42', 'NONE'), ('the', 'NONE'), ('voices', 'NONE'), ('d83d', 'NONE'), ('dd0a', 'NONE'), ('also', 'NONE'), ('d83d', 'NONE'), ('dc68', 'NONE'), ('mp3', 'NONE'), ('is', 'NONE'), ('an', 'NONE'), ('audio', 'NONE'), ('file', 'NONE'), ('d83d', 'NONE'), ('dcc2', 'NONE'), ('so', 'NONE'), ('the', 'NONE'), ('reason', 'NONE'), ('d83c', 'NONE'), ('df1f', 'NONE'), ('every', 'NONE'), ('d83d', 'NONE'), ('dcaf', 'NONE'), ('sound', 'NONE'), ('d83d', 'NONE'), ('dd0a', 'NONE'), ('is', 'NONE'), ('a', 'NONE'), ('piano', 'INSTR'), ('d83c', 'NONE'), ('dfb9', 'NONE'), ('is', 'NONE'), ('because', 'NONE'), ('it', 'NONE'), ('was', 'NONE'), ('as', 'NONE'), ('if', 'NONE'), ('every', 'NONE'), ('261d', 'NONE'), ('d83c', 'NONE'), ('dffc', 'NONE'), ('sound', 'NONE'), ('d83d', 'NONE'), ('dc42', 'NONE'), ('drums', 'INSTR'), ('d83e', 'NONE'), ('dd41', 'NONE'), ('and', 'NONE'), ('all', 'NONE'), ('d83d', 'NONE'), ('dcaf', 'NONE'), ('were', 'NONE'), ('being', 'NONE'), ('played', 'NONE'), ('d83c', 'NONE'), ('dfb2', 'NONE'), ('in', 'NONE'), ('the', 'NONE'), ('same', 'NONE'), ('channel', 'NONE'), ('d83d', 'NONE'), ('dcfa', 'NONE'), ('d83d', 'NONE'), ('dce1', 'NONE'), ('and', 'NONE'), ('since', 'NONE'), ('d83d', 'NONE'), ('dc68', 'NONE'), ('drums', 'INSTR'), ('d83e', 'NONE'), ('dd41', 'NONE'), ('technically', 'NONE'), ('d83e', 'NONE'), ('dd4b', 'NONE'), ('d83e', 'NONE'), ('dd39', 'NONE'), ('have', 'NONE'), ('pitch', 'NONE'), ('d83c', 'NONE'), ('dfa4', 'NONE'), ('as', 'NONE'), ('well', 'NONE'), ('d83d', 'NONE'), ('de26', 'NONE'), ('d83d', 'NONE'), ('dc40', 'NONE'), ('d83e', 'NONE'), ('dd37', 'NONE'), ('as', 'NONE'), ('overtones', 'NONE'), ('that', 'NONE'), ('s', 'NONE'), ('d83d', 'NONE'), ('de26', 'NONE'), ('why', 'NONE'), ('d83e', 'NONE'), ('dd14', 'NONE'), ('d83e', 'NONE'), ('dd37', 'NONE'), ('you', 'NONE'), ('d83d', 'NONE'), ('dc48', 'NONE'), ('hear', 'NONE'), ('d83d', 'NONE'), ('dc42', 'NONE'), ('that', 'NONE'), ('low', 'NONE'), ('d83d', 'NONE'), ('dd09', 'NONE'), ('horror', 'QLTY'), ('d83d', 'NONE'), ('de31', 'NONE'), ('sound', 'NONE'), ('d83d', 'NONE'), ('dd0a', 'NONE'), ('in', 'NONE'), ('a', 'NONE'), ('converted', 'NONE'), ('21aa', 'NONE'), ('drum', 'INSTR'), ('d83e', 'NONE'), ('dd41', 'NONE'), ('midi', 'NONE'), ('d83c', 'NONE'), ('dd92', 'NONE'), ('note', 'NONE'), ('d83d', 'NONE'), ('dcd3', 'NONE'), ('d83d', 'NONE'), ('dcda', 'NONE'), ('d83d', 'NONE'), ('dcd2', 'NONE'), ('midi', 'NONE'), ('d83c', 'NONE'), ('dd92', 'NONE'), ('technically', 'NONE'), ('d83d', 'NONE'), ('dd27', 'NONE'), ('274c', 'NONE'), ('isn', 'NONE'), ('t', 'NONE'), ('an', 'NONE'), ('audio', 'NONE'), ('file', 'NONE'), ('d83d', 'NONE'), ('de0d', 'NONE'), ('as', 'NONE'), ('nothing', 'NONE'), ('274c', 'NONE'), ('274e', 'NONE'), ('has', 'NONE'), ('been', 'NONE'), ('recorded', 'NONE'), ('d83d', 'NONE'), ('dcf7', 'NONE'), ('d83d', 'NONE'), ('dcf8', 'NONE'), ('d83c', 'NONE'), ('dfa5', 'NONE'), ('it', 'NONE'), ('s', 'NONE'), ('more', 'NONE'), ('like', 'NONE'), ('d83d', 'NONE'), ('dc4d', 'NONE'), ('sheet', 'NONE'), ('d83d', 'NONE'), ('decf', 'NONE'), ('music', 'NONE'), ('d83d', 'NONE'), ('dd0a', 'NONE'), ('d83c', 'NONE'), ('dfb5', 'NONE'), ('d83c', 'NONE'), ('dfb6', 'NONE'), ('in', 'NONE'), ('that', 'NONE'), ('it', 'NONE'), ('s', 'NONE'), ('a', 'NONE'), ('set', 'NONE'), ('d83d', 'NONE'), ('dcd0', 'NONE'), ('of', 'NONE'), ('instructions', 'NONE'), ('26a0', 'NONE'), ('being', 'NONE'), ('read', 'NONE'), ('d83d', 'NONE'), ('dcd6', 'NONE'), ('to', 'NONE'), ('a', 'NONE'), ('computer', 'NONE'), ('d83d', 'NONE'), ('dcbb', 'NONE'), ('i', 'NONE'), ('e', 'NONE'), ('d83c', 'NONE'), ('df6d', 'NONE'), ('d83c', 'NONE'), ('dd71', 'NONE'), ('play', 'NONE'), ('d83c', 'NONE'), ('dfbd', 'NONE'), ('this', 'NONE'), ('sound', 'NONE'), ('d83d', 'NONE'), ('dc42', 'NONE'), ('at', 'NONE'), ('this', 'NONE'), ('pitch', 'NONE'), ('d83d', 'NONE'), ('deab', 'NONE'), ('d83d', 'NONE'), ('de46', 'NONE'), ('d83c', 'NONE'), ('dffb', 'NONE'), ('at', 'NONE'), ('this', 'NONE'), ('time', 'NONE'), ('23f0', 'NONE')]
When music is converted to MIDI you can listen to songs for a ton If you want to remove one of the strings and play the guitar create a lot of frequencies The biggest voice is that we actually hear the recording Others call it dubbing and we don t hear it but dubbing makes a different violin sound than a piano Dubbing is a tool we call Tim Bray MIDI is like a music table read from a computer so the main field is not written when you convert MP3 to MIDI Pt calculates small changes in process and volume such as new notes and other recordings Human voices also have a rear sound so even listening like a piano the main instrument in most MIDI DLSes midi still plays bass so you can hear the sound In addition MP3 is an audio file so it seems that all sounds are played on the same channel so all sounds are piano Drums technically have the same tone so you hear a low horror in the MIDI drum converter Note Technically MIDI is not an audio file because it has no record it s like music read on your computer as Play this sound in the field at the moment;[('when', 'NONE'), ('music', 'NONE'), ('is', 'NONE'), ('converted', 'NONE'), ('to', 'NONE'), ('midi', 'NONE'), ('you', 'NONE'), ('can', 'NONE'), ('listen', 'NONE'), ('to', 'NONE'), ('songs', 'NONE'), ('for', 'NONE'), ('a', 'NONE'), ('ton', 'NONE'), ('if', 'NONE'), ('you', 'NONE'), ('want', 'NONE'), ('to', 'NONE'), ('remove', 'NONE'), ('one', 'NONE'), ('of', 'NONE'), ('the', 'NONE'), ('strings', 'NONE'), ('and', 'NONE'), ('play', 'NONE'), ('the', 'NONE'), ('guitar', 'INSTR'), ('create', 'NONE'), ('a', 'NONE'), ('lot', 'NONE'), ('of', 'NONE'), ('frequencies', 'NONE'), ('the', 'NONE'), ('biggest', 'NONE'), ('voice', 'NONE'), ('is', 'NONE'), ('that', 'NONE'), ('we', 'NONE'), ('actually', 'NONE'), ('hear', 'NONE'), ('the', 'NONE'), ('recording', 'NONE'), ('others', 'NONE'), ('call', 'NONE'), ('it', 'NONE'), ('dubbing', 'NONE'), ('and', 'NONE'), ('we', 'NONE'), ('don', 'NONE'), ('t', 'NONE'), ('hear', 'NONE'), ('it', 'NONE'), ('but', 'NONE'), ('dubbing', 'NONE'), ('makes', 'NONE'), ('a', 'NONE'), ('different', 'NONE'), ('violin', 'INSTR'), ('sound', 'NONE'), ('than', 'NONE'), ('a', 'NONE'), ('piano', 'INSTR'), ('dubbing', 'NONE'), ('is', 'NONE'), ('a', 'NONE'), ('tool', 'NONE'), ('we', 'NONE'), ('call', 'NONE'), ('tim', 'NONE'), ('bray', 'NONE'), ('midi', 'NONE'), ('is', 'NONE'), ('like', 'NONE'), ('a', 'NONE'), ('music', 'NONE'), ('table', 'NONE'), ('read', 'NONE'), ('from', 'NONE'), ('a', 'NONE'), ('computer', 'NONE'), ('so', 'NONE'), ('the', 'NONE'), ('main', 'NONE'), ('field', 'NONE'), ('is', 'NONE'), ('not', 'NONE'), ('written', 'NONE'), ('when', 'NONE'), ('you', 'NONE'), ('convert', 'NONE'), ('mp3', 'NONE'), ('to', 'NONE'), ('midi', 'NONE'), ('pt', 'NONE'), ('calculates', 'NONE'), ('small', 'NONE'), ('changes', 'NONE'), ('in', 'NONE'), ('process', 'NONE'), ('and', 'NONE'), ('volume', 'NONE'), ('such', 'NONE'), ('as', 'NONE'), ('new', 'NONE'), ('notes', 'NONE'), ('and', 'NONE'), ('other', 'NONE'), ('recordings', 'NONE'), ('human', 'NONE'), ('voices', 'NONE'), ('also', 'NONE'), ('have', 'NONE'), ('a', 'NONE'), ('rear', 'NONE'), ('sound', 'NONE'), ('so', 'NONE'), ('even', 'NONE'), ('listening', 'NONE'), ('like', 'NONE'), ('a', 'NONE'), ('piano', 'INSTR'), ('the', 'NONE'), ('main', 'NONE'), ('instrument', 'NONE'), ('in', 'NONE'), ('most', 'NONE'), ('midi', 'NONE'), ('dlses', 'NONE'), ('midi', 'NONE'), ('still', 'NONE'), ('plays', 'NONE'), ('bass', 'NONE'), ('so', 'NONE'), ('you', 'NONE'), ('can', 'NONE'), ('hear', 'NONE'), ('the', 'NONE'), ('sound', 'NONE'), ('in', 'NONE'), ('addition', 'NONE'), ('mp3', 'NONE'), ('is', 'NONE'), ('an', 'NONE'), ('audio', 'NONE'), ('file', 'NONE'), ('so', 'NONE'), ('it', 'NONE'), ('seems', 'NONE'), ('that', 'NONE'), ('all', 'NONE'), ('sounds', 'NONE'), ('are', 'NONE'), ('played', 'NONE'), ('on', 'NONE'), ('the', 'NONE'), ('same', 'NONE'), ('channel', 'NONE'), ('so', 'NONE'), ('all', 'NONE'), ('sounds', 'NONE'), ('are', 'NONE'), ('piano', 'INSTR'), ('drums', 'INSTR'), ('technically', 'NONE'), ('have', 'NONE'), ('the', 'NONE'), ('same', 'NONE'), ('tone', 'NONE'), ('so', 'NONE'), ('you', 'NONE'), ('hear', 'NONE'), ('a', 'NONE'), ('low', 'NONE'), ('horror', 'QLTY'), ('in', 'NONE'), ('the', 'NONE'), ('midi', 'NONE'), ('drum', 'INSTR'), ('converter', 'NONE'), ('note', 'NONE'), ('technically', 'NONE'), ('midi', 'NONE'), ('is', 'NONE'), ('not', 'NONE'), ('an', 'NONE'), ('audio', 'NONE'), ('file', 'NONE'), ('because', 'NONE'), ('it', 'NONE'), ('has', 'NONE'), ('no', 'NONE'), ('record', 'NONE'), ('it', 'NONE'), ('s', 'NONE'), ('like', 'NONE'), ('music', 'NONE'), ('read', 'NONE'), ('on', 'NONE'), ('your', 'NONE'), ('computer', 'NONE'), ('as', 'NONE'), ('play', 'NONE'), ('this', 'NONE'), ('sound', 'NONE'), ('in', 'NONE'), ('the', 'NONE'), ('field', 'NONE'), ('at', 'NONE'), ('the', 'NONE'), ('moment', 'NONE')]
