text;split_sentences
Attack timbre variation like when plucking guitar strings from different directions;[('attack', 'NONE'), ('timbre', 'NONE'), ('variation', 'NONE'), ('like', 'NONE'), ('when', 'NONE'), ('plucking', 'NONE'), ('guitar', 'INSTR'), ('strings', 'NONE'), ('from', 'NONE'), ('different', 'NONE'), ('directions', 'NONE')]
Description Clean Spanish Guitar Dm me on IG for full loop collabs Share what you ve made;[('description', 'NONE'), ('clean', 'NONE'), ('spanish guitar', 'INSTR'), ('dm', 'NONE'), ('me', 'NONE'), ('on', 'NONE'), ('ig', 'NONE'), ('for', 'NONE'), ('full', 'NONE'), ('loop', 'NONE'), ('collabs', 'NONE'), ('share', 'NONE'), ('what', 'NONE'), ('you', 'NONE'), ('ve', 'NONE'), ('made', 'NONE')]
Getting into classical guitar Any recommendations;[('getting', 'NONE'), ('into', 'NONE'), ('classical guitar', 'INSTR'), ('any', 'NONE'), ('recommendations', 'NONE')]
Francisco Tarrega Ferdinand Sor Mauro Giuliani Gaspar Sanz Mario Castelnuovo-Tedesco Agustin Barrios Mangore Joaquin Rodrigo Plus of course Bach s lute suites and many of his other pieces often transcribed for guitar Many transcriptions from Albeniz Etc etc;[('francisco', 'NONE'), ('tarrega', 'NONE'), ('ferdinand', 'NONE'), ('sor', 'NONE'), ('mauro', 'NONE'), ('giuliani', 'NONE'), ('gaspar', 'NONE'), ('sanz', 'NONE'), ('mario', 'NONE'), ('castelnuovo-tedesco', 'NONE'), ('agustin', 'NONE'), ('barrios', 'NONE'), ('mangore', 'NONE'), ('joaquin', 'NONE'), ('rodrigo', 'NONE'), ('plus', 'NONE'), ('of', 'NONE'), ('course', 'NONE'), ('bach', 'NONE'), ('s', 'NONE'), ('lute', 'INSTR'), ('suites', 'NONE'), ('and', 'NONE'), ('many', 'NONE'), ('of', 'NONE'), ('his', 'NONE'), ('other', 'NONE'), ('pieces', 'NONE'), ('often', 'NONE'), ('transcribed', 'NONE'), ('for', 'NONE'), ('guitar', 'INSTR'), ('many', 'NONE'), ('transcriptions', 'NONE'), ('from', 'NONE'), ('albeniz', 'NONE'), ('etc', 'NONE'), ('etc', 'NONE')]
Andr 00e9s Segovia Album Works for Guitar Absolute genius virtuoso;[('andr', 'NONE'), ('00e9s', 'NONE'), ('segovia', 'NONE'), ('album', 'NONE'), ('works', 'NONE'), ('for', 'NONE'), ('guitar', 'INSTR'), ('absolute', 'NONE'), ('genius', 'NONE'), ('virtuoso', 'NONE')]
They weren t originally written for guitar but Domenico Scarlatti s 555 keyboard Sonatas have many adaptations for guitar My favorites are K 27 in B minor and K 208 in A Major Both are just absolutely beautiful compositions and they sound very natural on guitar;[('they', 'NONE'), ('weren', 'NONE'), ('t', 'NONE'), ('originally', 'NONE'), ('written', 'NONE'), ('for', 'NONE'), ('guitar', 'INSTR'), ('but', 'NONE'), ('domenico', 'NONE'), ('scarlatti', 'NONE'), ('s', 'NONE'), ('555', 'NONE'), ('keyboard', 'NONE'), ('sonatas', 'NONE'), ('have', 'NONE'), ('many', 'NONE'), ('adaptations', 'NONE'), ('for', 'NONE'), ('guitar', 'INSTR'), ('my', 'NONE'), ('favorites', 'NONE'), ('are', 'NONE'), ('k', 'NONE'), ('27', 'NONE'), ('in', 'NONE'), ('b', 'NONE'), ('minor', 'NONE'), ('and', 'NONE'), ('k', 'NONE'), ('208', 'NONE'), ('in', 'NONE'), ('a', 'NONE'), ('major', 'NONE'), ('both', 'NONE'), ('are', 'NONE'), ('just', 'NONE'), ('absolutely', 'NONE'), ('beautiful', 'NONE'), ('compositions', 'NONE'), ('and', 'NONE'), ('they', 'NONE'), ('sound', 'NONE'), ('very', 'NONE'), ('natural', 'NONE'), ('on', 'NONE'), ('guitar', 'INSTR')]
Essentials for me it changes daily Tarrega s Capricho arabe played by Dylla - I love watching this guy play it s a bit theatric but I eat it up Dyen s Tango en skai played by Caballero - just straight up shredding Tarrega s Recuerdos played by Bream - afaik this is the Neutral Milk Hotel of classical guitar all the good memes are about this incredibly overplayed piece but it s still a solid piece to enjoy and those machine gun notes you hear are called tremolo And then I d add on for variety Andrew York s Home - I feel like I might get castigated for this York seems like a controversial popular composer but I still think Home is a beautiful tender piece Tennant s Wild Mountain Thyme - author of the important technique book Pumping Nylon Tennant shows off what the guitar can do to this beautiful traditional tune D Angelo s Canzone - this is like a cold shower beware I love this piece since it shows the guitar is capable of way more than Spanish arpeggios and folksy transcriptions I don t know what the heck is going on but it s exhilarating and savage;[('essentials', 'NONE'), ('for', 'NONE'), ('me', 'NONE'), ('it', 'NONE'), ('changes', 'NONE'), ('daily', 'NONE'), ('tarrega', 'NONE'), ('s', 'NONE'), ('capricho', 'NONE'), ('arabe', 'NONE'), ('played', 'NONE'), ('by', 'NONE'), ('dylla', 'NONE'), ('-', 'NONE'), ('i', 'NONE'), ('love', 'NONE'), ('watching', 'NONE'), ('this', 'NONE'), ('guy', 'NONE'), ('play', 'NONE'), ('it', 'NONE'), ('s', 'NONE'), ('a', 'NONE'), ('bit', 'NONE'), ('theatric', 'NONE'), ('but', 'NONE'), ('i', 'NONE'), ('eat', 'NONE'), ('it', 'NONE'), ('up', 'NONE'), ('dyen', 'NONE'), ('s', 'NONE'), ('tango', 'NONE'), ('en', 'NONE'), ('skai', 'NONE'), ('played', 'NONE'), ('by', 'NONE'), ('caballero', 'NONE'), ('-', 'NONE'), ('just', 'NONE'), ('straight', 'NONE'), ('up', 'NONE'), ('shredding', 'NONE'), ('tarrega', 'NONE'), ('s', 'NONE'), ('recuerdos', 'NONE'), ('played', 'NONE'), ('by', 'NONE'), ('bream', 'NONE'), ('-', 'NONE'), ('afaik', 'NONE'), ('this', 'NONE'), ('is', 'NONE'), ('the', 'NONE'), ('neutral', 'NONE'), ('milk', 'NONE'), ('hotel', 'NONE'), ('of', 'NONE'), ('classical guitar', 'INSTR'), ('all', 'NONE'), ('the', 'NONE'), ('good', 'NONE'), ('memes', 'NONE'), ('are', 'NONE'), ('about', 'NONE'), ('this', 'NONE'), ('incredibly', 'NONE'), ('overplayed', 'NONE'), ('piece', 'NONE'), ('but', 'NONE'), ('it', 'NONE'), ('s', 'NONE'), ('still', 'NONE'), ('a', 'NONE'), ('solid', 'NONE'), ('piece', 'NONE'), ('to', 'NONE'), ('enjoy', 'NONE'), ('and', 'NONE'), ('those', 'NONE'), ('machine', 'NONE'), ('gun', 'NONE'), ('notes', 'NONE'), ('you', 'NONE'), ('hear', 'NONE'), ('are', 'NONE'), ('called', 'NONE'), ('tremolo', 'NONE'), ('and', 'NONE'), ('then', 'NONE'), ('i', 'NONE'), ('d', 'NONE'), ('add', 'NONE'), ('on', 'NONE'), ('for', 'NONE'), ('variety', 'NONE'), ('andrew', 'NONE'), ('york', 'NONE'), ('s', 'NONE'), ('home', 'NONE'), ('-', 'NONE'), ('i', 'NONE'), ('feel', 'NONE'), ('like', 'NONE'), ('i', 'NONE'), ('might', 'NONE'), ('get', 'NONE'), ('castigated', 'NONE'), ('for', 'NONE'), ('this', 'NONE'), ('york', 'NONE'), ('seems', 'NONE'), ('like', 'NONE'), ('a', 'NONE'), ('controversial', 'NONE'), ('popular', 'NONE'), ('composer', 'NONE'), ('but', 'NONE'), ('i', 'NONE'), ('still', 'NONE'), ('think', 'NONE'), ('home', 'NONE'), ('is', 'NONE'), ('a', 'NONE'), ('beautiful', 'NONE'), ('tender', 'NONE'), ('piece', 'NONE'), ('tennant', 'NONE'), ('s', 'NONE'), ('wild', 'NONE'), ('mountain', 'NONE'), ('thyme', 'NONE'), ('-', 'NONE'), ('author', 'NONE'), ('of', 'NONE'), ('the', 'NONE'), ('important', 'NONE'), ('technique', 'NONE'), ('book', 'NONE'), ('pumping', 'NONE'), ('nylon', 'NONE'), ('tennant', 'NONE'), ('shows', 'NONE'), ('off', 'NONE'), ('what', 'NONE'), ('the', 'NONE'), ('guitar', 'INSTR'), ('can', 'NONE'), ('do', 'NONE'), ('to', 'NONE'), ('this', 'NONE'), ('beautiful', 'NONE'), ('traditional', 'NONE'), ('tune', 'NONE'), ('d', 'NONE'), ('angelo', 'NONE'), ('s', 'NONE'), ('canzone', 'NONE'), ('-', 'NONE'), ('this', 'NONE'), ('is', 'NONE'), ('like', 'NONE'), ('a', 'NONE'), ('cold', 'NONE'), ('shower', 'NONE'), ('beware', 'NONE'), ('i', 'NONE'), ('love', 'NONE'), ('this', 'NONE'), ('piece', 'NONE'), ('since', 'NONE'), ('it', 'NONE'), ('shows', 'NONE'), ('the', 'NONE'), ('guitar', 'INSTR'), ('is', 'NONE'), ('capable', 'NONE'), ('of', 'NONE'), ('way', 'NONE'), ('more', 'NONE'), ('than', 'NONE'), ('spanish', 'NONE'), ('arpeggios', 'NONE'), ('and', 'NONE'), ('folksy', 'NONE'), ('transcriptions', 'NONE'), ('i', 'NONE'), ('don', 'NONE'), ('t', 'NONE'), ('know', 'NONE'), ('what', 'NONE'), ('the', 'NONE'), ('heck', 'NONE'), ('is', 'NONE'), ('going', 'NONE'), ('on', 'NONE'), ('but', 'NONE'), ('it', 'NONE'), ('s', 'NONE'), ('exhilarating', 'NONE'), ('and', 'NONE'), ('savage', 'NONE')]
Be sure to also include the lute and Early Music;[('be', 'NONE'), ('sure', 'NONE'), ('to', 'NONE'), ('also', 'NONE'), ('include', 'NONE'), ('the', 'NONE'), ('lute', 'INSTR'), ('and', 'NONE'), ('early', 'NONE'), ('music', 'NONE')]
Bach Lute Suite no 4 in E major BWV 1006a is mesmerising I would highly recommend listening to his other pieces for lute as well;[('bach', 'NONE'), ('lute', 'INSTR'), ('suite', 'NONE'), ('no', 'NONE'), ('4', 'NONE'), ('in', 'NONE'), ('e', 'NONE'), ('major', 'NONE'), ('bwv', 'NONE'), ('1006a', 'NONE'), ('is', 'NONE'), ('mesmerising', 'NONE'), ('i', 'NONE'), ('would', 'NONE'), ('highly', 'NONE'), ('recommend', 'NONE'), ('listening', 'NONE'), ('to', 'NONE'), ('his', 'NONE'), ('other', 'NONE'), ('pieces', 'NONE'), ('for', 'NONE'), ('lute', 'INSTR'), ('as', 'NONE'), ('well', 'NONE')]
Paganini 2019s Guitar Sonatas and also his Violin Guitar Sonatas;[('paganini', 'NONE'), ('2019s', 'NONE'), ('guitar', 'INSTR'), ('sonatas', 'NONE'), ('and', 'NONE'), ('also', 'NONE'), ('his', 'NONE'), ('violin', 'INSTR'), ('guitar', 'INSTR'), ('sonatas', 'NONE')]
I think the best approach is to focus on great players The albums they ve recorded will introduce you to important composers for the guitar Seeking out recordings based on the composers alone will get you mixed results The trinity of historically important players from last century are Andre Segovia Julian Bream John Williams These guys have each released great recordings and you ve been recommended them many times over They are not however necessarily the best representatives of the genre Here s a more recent selection of great players all well worth a listen Manuel Barrueco Sean Shibe Kyuhee Park David Russel Sharon Isbin It would be a mistake to get into the old masters and never give new artists a listen In many respects they are technically superior and they certainly play a more varied repertoire;[('i', 'NONE'), ('think', 'NONE'), ('the', 'NONE'), ('best', 'NONE'), ('approach', 'NONE'), ('is', 'NONE'), ('to', 'NONE'), ('focus', 'NONE'), ('on', 'NONE'), ('great', 'NONE'), ('players', 'NONE'), ('the', 'NONE'), ('albums', 'NONE'), ('they', 'NONE'), ('ve', 'NONE'), ('recorded', 'NONE'), ('will', 'NONE'), ('introduce', 'NONE'), ('you', 'NONE'), ('to', 'NONE'), ('important', 'NONE'), ('composers', 'NONE'), ('for', 'NONE'), ('the', 'NONE'), ('guitar', 'INSTR'), ('seeking', 'NONE'), ('out', 'NONE'), ('recordings', 'NONE'), ('based', 'NONE'), ('on', 'NONE'), ('the', 'NONE'), ('composers', 'NONE'), ('alone', 'NONE'), ('will', 'NONE'), ('get', 'NONE'), ('you', 'NONE'), ('mixed', 'NONE'), ('results', 'NONE'), ('the', 'NONE'), ('trinity', 'NONE'), ('of', 'NONE'), ('historically', 'NONE'), ('important', 'NONE'), ('players', 'NONE'), ('from', 'NONE'), ('last', 'NONE'), ('century', 'NONE'), ('are', 'NONE'), ('andre', 'NONE'), ('segovia', 'NONE'), ('julian', 'NONE'), ('bream', 'NONE'), ('john', 'NONE'), ('williams', 'NONE'), ('these', 'NONE'), ('guys', 'NONE'), ('have', 'NONE'), ('each', 'NONE'), ('released', 'NONE'), ('great', 'NONE'), ('recordings', 'NONE'), ('and', 'NONE'), ('you', 'NONE'), ('ve', 'NONE'), ('been', 'NONE'), ('recommended', 'NONE'), ('them', 'NONE'), ('many', 'NONE'), ('times', 'NONE'), ('over', 'NONE'), ('they', 'NONE'), ('are', 'NONE'), ('not', 'NONE'), ('however', 'NONE'), ('necessarily', 'NONE'), ('the', 'NONE'), ('best', 'NONE'), ('representatives', 'NONE'), ('of', 'NONE'), ('the', 'NONE'), ('genre', 'NONE'), ('here', 'NONE'), ('s', 'NONE'), ('a', 'NONE'), ('more', 'NONE'), ('recent', 'NONE'), ('selection', 'NONE'), ('of', 'NONE'), ('great', 'NONE'), ('players', 'NONE'), ('all', 'NONE'), ('well', 'NONE'), ('worth', 'NONE'), ('a', 'NONE'), ('listen', 'NONE'), ('manuel', 'NONE'), ('barrueco', 'NONE'), ('sean', 'NONE'), ('shibe', 'NONE'), ('kyuhee', 'NONE'), ('park', 'NONE'), ('david', 'NONE'), ('russel', 'NONE'), ('sharon', 'NONE'), ('isbin', 'NONE'), ('it', 'NONE'), ('would', 'NONE'), ('be', 'NONE'), ('a', 'NONE'), ('mistake', 'NONE'), ('to', 'NONE'), ('get', 'NONE'), ('into', 'NONE'), ('the', 'NONE'), ('old', 'NONE'), ('masters', 'NONE'), ('and', 'NONE'), ('never', 'NONE'), ('give', 'NONE'), ('new', 'NONE'), ('artists', 'NONE'), ('a', 'NONE'), ('listen', 'NONE'), ('in', 'NONE'), ('many', 'NONE'), ('respects', 'NONE'), ('they', 'NONE'), ('are', 'NONE'), ('technically', 'NONE'), ('superior', 'NONE'), ('and', 'NONE'), ('they', 'NONE'), ('certainly', 'NONE'), ('play', 'NONE'), ('a', 'NONE'), ('more', 'NONE'), ('varied', 'NONE'), ('repertoire', 'NONE')]
Paganini wrote a high amount of guitar pieces Bach did write some stuff for guitar but a lot of his stuff sounds great on guitar despite what instrument a given piece was written for;[('paganini', 'NONE'), ('wrote', 'NONE'), ('a', 'NONE'), ('high', 'NONE'), ('amount', 'NONE'), ('of', 'NONE'), ('guitar', 'INSTR'), ('pieces', 'NONE'), ('bach', 'NONE'), ('did', 'NONE'), ('write', 'NONE'), ('some', 'NONE'), ('stuff', 'NONE'), ('for', 'NONE'), ('guitar', 'INSTR'), ('but', 'NONE'), ('a', 'NONE'), ('lot', 'NONE'), ('of', 'NONE'), ('his', 'NONE'), ('stuff', 'NONE'), ('sounds', 'NONE'), ('great', 'NONE'), ('on', 'NONE'), ('guitar', 'INSTR'), ('despite', 'NONE'), ('what', 'NONE'), ('instrument', 'NONE'), ('a', 'NONE'), ('given', 'NONE'), ('piece', 'NONE'), ('was', 'NONE'), ('written', 'NONE'), ('for', 'NONE')]
To my ears this is very loud I can see where you are going with the mix although there are a lot of low mids in your mix Remember don t fall for the louder sounds better trick I d tame those guitars a little and add a bit more punch to the drums Try some parallel compression and make space in your mix for both guitar parts Nice work so far though;[('to', 'NONE'), ('my', 'NONE'), ('ears', 'NONE'), ('this', 'NONE'), ('is', 'NONE'), ('very', 'NONE'), ('loud', 'NONE'), ('i', 'NONE'), ('can', 'NONE'), ('see', 'NONE'), ('where', 'NONE'), ('you', 'NONE'), ('are', 'NONE'), ('going', 'NONE'), ('with', 'NONE'), ('the', 'NONE'), ('mix', 'NONE'), ('although', 'NONE'), ('there', 'NONE'), ('are', 'NONE'), ('a', 'NONE'), ('lot', 'NONE'), ('of', 'NONE'), ('low', 'NONE'), ('mids', 'NONE'), ('in', 'NONE'), ('your', 'NONE'), ('mix', 'NONE'), ('remember', 'NONE'), ('don', 'NONE'), ('t', 'NONE'), ('fall', 'NONE'), ('for', 'NONE'), ('the', 'NONE'), ('louder', 'NONE'), ('sounds', 'NONE'), ('better', 'NONE'), ('trick', 'NONE'), ('i', 'NONE'), ('d', 'NONE'), ('tame', 'NONE'), ('those', 'NONE'), ('guitars', 'INSTR'), ('a', 'NONE'), ('little', 'NONE'), ('and', 'NONE'), ('add', 'NONE'), ('a', 'NONE'), ('bit', 'NONE'), ('more', 'NONE'), ('punch', 'NONE'), ('to', 'NONE'), ('the', 'NONE'), ('drums', 'INSTR'), ('try', 'NONE'), ('some', 'NONE'), ('parallel', 'NONE'), ('compression', 'NONE'), ('and', 'NONE'), ('make', 'NONE'), ('space', 'NONE'), ('in', 'NONE'), ('your', 'NONE'), ('mix', 'NONE'), ('for', 'NONE'), ('both', 'NONE'), ('guitar', 'INSTR'), ('parts', 'NONE'), ('nice', 'NONE'), ('work', 'NONE'), ('so', 'NONE'), ('far', 'NONE'), ('though', 'NONE')]
I don t play the guitar but aren t there sharps or flats;[('i', 'NONE'), ('don', 'NONE'), ('t', 'NONE'), ('play', 'NONE'), ('the', 'NONE'), ('guitar', 'INSTR'), ('but', 'NONE'), ('aren', 'NONE'), ('t', 'NONE'), ('there', 'NONE'), ('sharps', 'NONE'), ('or', 'NONE'), ('flats', 'NONE')]
Description Piano loop for Mac Miller type beats Leave your work in comments For more loops hit DM on Instagram click avatar;[('description', 'NONE'), ('piano', 'INSTR'), ('loop', 'NONE'), ('for', 'NONE'), ('mac', 'NONE'), ('miller', 'NONE'), ('type', 'NONE'), ('beats', 'NONE'), ('leave', 'NONE'), ('your', 'NONE'), ('work', 'NONE'), ('in', 'NONE'), ('comments', 'NONE'), ('for', 'NONE'), ('more', 'NONE'), ('loops', 'NONE'), ('hit', 'NONE'), ('dm', 'NONE'), ('on', 'NONE'), ('instagram', 'NONE'), ('click', 'NONE'), ('avatar', 'NONE')]
Description Acoustic guitar loop for Gunna Lil Baby type beats Leave your work in comments For more loops hit DM on Instagram click avatar;[('description', 'NONE'), ('acoustic guitar', 'INSTR'), ('loop', 'NONE'), ('for', 'NONE'), ('gunna', 'NONE'), ('lil', 'NONE'), ('baby', 'NONE'), ('type', 'NONE'), ('beats', 'NONE'), ('leave', 'NONE'), ('your', 'NONE'), ('work', 'NONE'), ('in', 'NONE'), ('comments', 'NONE'), ('for', 'NONE'), ('more', 'NONE'), ('loops', 'NONE'), ('hit', 'NONE'), ('dm', 'NONE'), ('on', 'NONE'), ('instagram', 'NONE'), ('click', 'NONE'), ('avatar', 'NONE')]
Description Piano loop for Lil Baby type beats Leave your work in comments For more loops hit DM on Instagram click avatar;[('description', 'NONE'), ('piano', 'INSTR'), ('loop', 'NONE'), ('for', 'NONE'), ('lil', 'NONE'), ('baby', 'NONE'), ('type', 'NONE'), ('beats', 'NONE'), ('leave', 'NONE'), ('your', 'NONE'), ('work', 'NONE'), ('in', 'NONE'), ('comments', 'NONE'), ('for', 'NONE'), ('more', 'NONE'), ('loops', 'NONE'), ('hit', 'NONE'), ('dm', 'NONE'), ('on', 'NONE'), ('instagram', 'NONE'), ('click', 'NONE'), ('avatar', 'NONE')]
Stop suggesting plugins What is the sound of guitar;[('stop', 'NONE'), ('suggesting', 'NONE'), ('plugins', 'NONE'), ('what', 'NONE'), ('is', 'NONE'), ('the', 'NONE'), ('sound', 'NONE'), ('of', 'NONE'), ('guitar', 'INSTR')]
The same group had a song called Shambala that starts with a similar sound It was used extensively in some TV and or radio ads in recent years which made it pretty popular again FYI the first chords in Joy to the World are played with an electric piano not guitar;[('the', 'NONE'), ('same', 'NONE'), ('group', 'NONE'), ('had', 'NONE'), ('a', 'NONE'), ('song', 'NONE'), ('called', 'NONE'), ('shambala', 'NONE'), ('that', 'NONE'), ('starts', 'NONE'), ('with', 'NONE'), ('a', 'NONE'), ('similar', 'NONE'), ('sound', 'NONE'), ('it', 'NONE'), ('was', 'NONE'), ('used', 'NONE'), ('extensively', 'NONE'), ('in', 'NONE'), ('some', 'NONE'), ('tv', 'NONE'), ('and', 'NONE'), ('or', 'NONE'), ('radio', 'NONE'), ('ads', 'NONE'), ('in', 'NONE'), ('recent', 'NONE'), ('years', 'NONE'), ('which', 'NONE'), ('made', 'NONE'), ('it', 'NONE'), ('pretty', 'NONE'), ('popular', 'NONE'), ('again', 'NONE'), ('fyi', 'NONE'), ('the', 'NONE'), ('first', 'NONE'), ('chords', 'NONE'), ('in', 'NONE'), ('joy', 'NONE'), ('to', 'NONE'), ('the', 'NONE'), ('world', 'NONE'), ('are', 'NONE'), ('played', 'NONE'), ('with', 'NONE'), ('an', 'NONE'), ('electric piano', 'INSTR'), ('not', 'NONE'), ('guitar', 'INSTR')]
Out of these two even with the B2Ds deficiencies in guitars middle registers of piano as you mentioned with which do you enjoy listening to these instruments the most in your opinion For example what about the song you used Time Control Or Controlled By Time where did it sound better to you I m considering buying the B2s or B2Ds and can t decide but if the guitars piano sound too much off with the B2Ds that s a problem;[('out', 'NONE'), ('of', 'NONE'), ('these', 'NONE'), ('two', 'NONE'), ('even', 'NONE'), ('with', 'NONE'), ('the', 'NONE'), ('b2ds', 'NONE'), ('deficiencies', 'NONE'), ('in', 'NONE'), ('guitars', 'INSTR'), ('middle', 'NONE'), ('registers', 'NONE'), ('of', 'NONE'), ('piano', 'INSTR'), ('as', 'NONE'), ('you', 'NONE'), ('mentioned', 'NONE'), ('with', 'NONE'), ('which', 'NONE'), ('do', 'NONE'), ('you', 'NONE'), ('enjoy', 'NONE'), ('listening', 'NONE'), ('to', 'NONE'), ('these', 'NONE'), ('instruments', 'NONE'), ('the', 'NONE'), ('most', 'NONE'), ('in', 'NONE'), ('your', 'NONE'), ('opinion', 'NONE'), ('for', 'NONE'), ('example', 'NONE'), ('what', 'NONE'), ('about', 'NONE'), ('the', 'NONE'), ('song', 'NONE'), ('you', 'NONE'), ('used', 'NONE'), ('time', 'NONE'), ('control', 'NONE'), ('or', 'NONE'), ('controlled', 'NONE'), ('by', 'NONE'), ('time', 'NONE'), ('where', 'NONE'), ('did', 'NONE'), ('it', 'NONE'), ('sound', 'NONE'), ('better', 'NONE'), ('to', 'NONE'), ('you', 'NONE'), ('i', 'NONE'), ('m', 'NONE'), ('considering', 'NONE'), ('buying', 'NONE'), ('the', 'NONE'), ('b2s', 'NONE'), ('or', 'NONE'), ('b2ds', 'NONE'), ('and', 'NONE'), ('can', 'NONE'), ('t', 'NONE'), ('decide', 'NONE'), ('but', 'NONE'), ('if', 'NONE'), ('the', 'NONE'), ('guitars', 'INSTR'), ('piano', 'INSTR'), ('sound', 'NONE'), ('too', 'NONE'), ('much', 'NONE'), ('off', 'NONE'), ('with', 'NONE'), ('the', 'NONE'), ('b2ds', 'NONE'), ('that', 'NONE'), ('s', 'NONE'), ('a', 'NONE'), ('problem', 'NONE')]
1 Practice guitar You don t need to be able to play anything complicated but you need to be able to move through open chords easily 2 LISTEN Learn where the indie folk artists of today came from Woody Guthrie The Weavers Pete Seeger Phil Ochs Kingston Trio Dave Van Ronk etc;[('1', 'NONE'), ('practice', 'NONE'), ('guitar', 'INSTR'), ('you', 'NONE'), ('don', 'NONE'), ('t', 'NONE'), ('need', 'NONE'), ('to', 'NONE'), ('be', 'NONE'), ('able', 'NONE'), ('to', 'NONE'), ('play', 'NONE'), ('anything', 'NONE'), ('complicated', 'NONE'), ('but', 'NONE'), ('you', 'NONE'), ('need', 'NONE'), ('to', 'NONE'), ('be', 'NONE'), ('able', 'NONE'), ('to', 'NONE'), ('move', 'NONE'), ('through', 'NONE'), ('open', 'NONE'), ('chords', 'NONE'), ('easily', 'NONE'), ('2', 'NONE'), ('listen', 'NONE'), ('learn', 'NONE'), ('where', 'NONE'), ('the', 'NONE'), ('indie', 'NONE'), ('folk', 'NONE'), ('artists', 'NONE'), ('of', 'NONE'), ('today', 'NONE'), ('came', 'NONE'), ('from', 'NONE'), ('woody', 'NONE'), ('guthrie', 'NONE'), ('the', 'NONE'), ('weavers', 'NONE'), ('pete', 'NONE'), ('seeger', 'NONE'), ('phil', 'NONE'), ('ochs', 'NONE'), ('kingston', 'NONE'), ('trio', 'NONE'), ('dave', 'NONE'), ('van', 'NONE'), ('ronk', 'NONE'), ('etc', 'NONE')]
