text;split_sentences
It can be pretty useful on distorted guitar to give it a different timbre and accent a certain note within a chord For instance C m with an open high E string in addition to the fretted E on the B string sounds a little bit different than without the open E It s especially useful as a droning tone while playing a melody on another string as you can have an illusion of going between 1 note and 2 notes but the sound stays full and timbre stays mostly the same For a good example of this you can listen to the guitar at the beginning of My Hero by the Foo Fighters It also can just make things sound more aggressive to play fretted and open strings with the same pitch You get a stronger transient from picking multiple strings and combine the resonance of both strings Plus it s easier to strum more aggressively if you aren t worried as much about only strumming one string this also requires good muting technique to make sure you don t have all the other strings sounding A good example of this is the prechorus of On My Own by Saosin - All of these factors are much more about timbre than actual harmony though So for genres where timbre is typically less significant classical folk etc I would say it isn t really that significant However in terms of harmony it does enable a lot of droning notes for pedal point progressions or interesting spread voicings of chords;[('it', 'NONE'), ('can', 'NONE'), ('be', 'NONE'), ('pretty', 'NONE'), ('useful', 'NONE'), ('on', 'NONE'), ('distorted', 'QLTY'), ('guitar', 'INSTR'), ('to', 'NONE'), ('give', 'NONE'), ('it', 'NONE'), ('a', 'NONE'), ('different', 'NONE'), ('timbre', 'NONE'), ('and', 'NONE'), ('accent', 'NONE'), ('a', 'NONE'), ('certain', 'NONE'), ('note', 'NONE'), ('within', 'NONE'), ('a', 'NONE'), ('chord', 'NONE'), ('for', 'NONE'), ('instance', 'NONE'), ('c', 'NONE'), ('m', 'NONE'), ('with', 'NONE'), ('an', 'NONE'), ('open', 'NONE'), ('high', 'NONE'), ('e', 'NONE'), ('string', 'NONE'), ('in', 'NONE'), ('addition', 'NONE'), ('to', 'NONE'), ('the', 'NONE'), ('fretted', 'NONE'), ('e', 'NONE'), ('on', 'NONE'), ('the', 'NONE'), ('b', 'NONE'), ('string', 'NONE'), ('sounds', 'NONE'), ('a', 'NONE'), ('little', 'NONE'), ('bit', 'NONE'), ('different', 'NONE'), ('than', 'NONE'), ('without', 'NONE'), ('the', 'NONE'), ('open', 'NONE'), ('e', 'NONE'), ('it', 'NONE'), ('s', 'NONE'), ('especially', 'NONE'), ('useful', 'NONE'), ('as', 'NONE'), ('a', 'NONE'), ('droning', 'NONE'), ('tone', 'NONE'), ('while', 'NONE'), ('playing', 'NONE'), ('a', 'NONE'), ('melody', 'NONE'), ('on', 'NONE'), ('another', 'NONE'), ('string', 'NONE'), ('as', 'NONE'), ('you', 'NONE'), ('can', 'NONE'), ('have', 'NONE'), ('an', 'NONE'), ('illusion', 'NONE'), ('of', 'NONE'), ('going', 'NONE'), ('between', 'NONE'), ('1', 'NONE'), ('note', 'NONE'), ('and', 'NONE'), ('2', 'NONE'), ('notes', 'NONE'), ('but', 'NONE'), ('the', 'NONE'), ('sound', 'NONE'), ('stays', 'NONE'), ('full', 'NONE'), ('and', 'NONE'), ('timbre', 'NONE'), ('stays', 'NONE'), ('mostly', 'NONE'), ('the', 'NONE'), ('same', 'NONE'), ('for', 'NONE'), ('a', 'NONE'), ('good', 'NONE'), ('example', 'NONE'), ('of', 'NONE'), ('this', 'NONE'), ('you', 'NONE'), ('can', 'NONE'), ('listen', 'NONE'), ('to', 'NONE'), ('the', 'NONE'), ('guitar', 'INSTR'), ('at', 'NONE'), ('the', 'NONE'), ('beginning', 'NONE'), ('of', 'NONE'), ('my', 'NONE'), ('hero', 'NONE'), ('by', 'NONE'), ('the', 'NONE'), ('foo', 'NONE'), ('fighters', 'NONE'), ('it', 'NONE'), ('also', 'NONE'), ('can', 'NONE'), ('just', 'NONE'), ('make', 'NONE'), ('things', 'NONE'), ('sound', 'NONE'), ('more', 'NONE'), ('aggressive', 'QLTY'), ('to', 'NONE'), ('play', 'NONE'), ('fretted', 'NONE'), ('and', 'NONE'), ('open', 'NONE'), ('strings', 'NONE'), ('with', 'NONE'), ('the', 'NONE'), ('same', 'NONE'), ('pitch', 'NONE'), ('you', 'NONE'), ('get', 'NONE'), ('a', 'NONE'), ('stronger', 'NONE'), ('transient', 'NONE'), ('from', 'NONE'), ('picking', 'NONE'), ('multiple', 'NONE'), ('strings', 'NONE'), ('and', 'NONE'), ('combine', 'NONE'), ('the', 'NONE'), ('resonance', 'NONE'), ('of', 'NONE'), ('both', 'NONE'), ('strings', 'NONE'), ('plus', 'NONE'), ('it', 'NONE'), ('s', 'NONE'), ('easier', 'NONE'), ('to', 'NONE'), ('strum', 'NONE'), ('more', 'NONE'), ('aggressively', 'NONE'), ('if', 'NONE'), ('you', 'NONE'), ('aren', 'NONE'), ('t', 'NONE'), ('worried', 'NONE'), ('as', 'NONE'), ('much', 'NONE'), ('about', 'NONE'), ('only', 'NONE'), ('strumming', 'NONE'), ('one', 'NONE'), ('string', 'NONE'), ('this', 'NONE'), ('also', 'NONE'), ('requires', 'NONE'), ('good', 'NONE'), ('muting', 'NONE'), ('technique', 'NONE'), ('to', 'NONE'), ('make', 'NONE'), ('sure', 'NONE'), ('you', 'NONE'), ('don', 'NONE'), ('t', 'NONE'), ('have', 'NONE'), ('all', 'NONE'), ('the', 'NONE'), ('other', 'NONE'), ('strings', 'NONE'), ('sounding', 'NONE'), ('a', 'NONE'), ('good', 'NONE'), ('example', 'NONE'), ('of', 'NONE'), ('this', 'NONE'), ('is', 'NONE'), ('the', 'NONE'), ('prechorus', 'NONE'), ('of', 'NONE'), ('on', 'NONE'), ('my', 'NONE'), ('own', 'NONE'), ('by', 'NONE'), ('saosin', 'NONE'), ('-', 'NONE'), ('all', 'NONE'), ('of', 'NONE'), ('these', 'NONE'), ('factors', 'NONE'), ('are', 'NONE'), ('much', 'NONE'), ('more', 'NONE'), ('about', 'NONE'), ('timbre', 'NONE'), ('than', 'NONE'), ('actual', 'NONE'), ('harmony', 'NONE'), ('though', 'NONE'), ('so', 'NONE'), ('for', 'NONE'), ('genres', 'NONE'), ('where', 'NONE'), ('timbre', 'NONE'), ('is', 'NONE'), ('typically', 'NONE'), ('less', 'NONE'), ('significant', 'NONE'), ('classical', 'NONE'), ('folk', 'NONE'), ('etc', 'NONE'), ('i', 'NONE'), ('would', 'NONE'), ('say', 'NONE'), ('it', 'NONE'), ('isn', 'NONE'), ('t', 'NONE'), ('really', 'NONE'), ('that', 'NONE'), ('significant', 'NONE'), ('however', 'NONE'), ('in', 'NONE'), ('terms', 'NONE'), ('of', 'NONE'), ('harmony', 'NONE'), ('it', 'NONE'), ('does', 'NONE'), ('enable', 'NONE'), ('a', 'NONE'), ('lot', 'NONE'), ('of', 'NONE'), ('droning', 'NONE'), ('notes', 'NONE'), ('for', 'NONE'), ('pedal', 'NONE'), ('point', 'NONE'), ('progressions', 'NONE'), ('or', 'NONE'), ('interesting', 'NONE'), ('spread', 'NONE'), ('voicings', 'NONE'), ('of', 'NONE'), ('chords', 'NONE')]
Description OLD school hip hop sample for agressive dark beatsContact me for more information and exclusive samples;[('description', 'NONE'), ('old', 'NONE'), ('school', 'NONE'), ('hip', 'NONE'), ('hop', 'NONE'), ('sample', 'NONE'), ('for', 'NONE'), ('agressive', 'QLTY'), ('dark', 'QLTY'), ('beatscontact', 'NONE'), ('me', 'NONE'), ('for', 'NONE'), ('more', 'NONE'), ('information', 'NONE'), ('and', 'NONE'), ('exclusive', 'NONE'), ('samples', 'NONE')]
Accessory House makes some great sheepskin pads for these Agreed otherwise It s a great headphone even if it can be a tad sharp the bass kicks like nothing else E-mu Teaks are also very good but they boost the mids considerably at the expense of some of the bass speed decay and have less sharp treble;[('accessory', 'NONE'), ('house', 'NONE'), ('makes', 'NONE'), ('some', 'NONE'), ('great', 'NONE'), ('sheepskin', 'NONE'), ('pads', 'NONE'), ('for', 'NONE'), ('these', 'NONE'), ('agreed', 'NONE'), ('otherwise', 'NONE'), ('it', 'NONE'), ('s', 'NONE'), ('a', 'NONE'), ('great', 'NONE'), ('headphone', 'NONE'), ('even', 'NONE'), ('if', 'NONE'), ('it', 'NONE'), ('can', 'NONE'), ('be', 'NONE'), ('a', 'NONE'), ('tad', 'NONE'), ('sharp', 'NONE'), ('the', 'NONE'), ('bass', 'NONE'), ('kicks', 'NONE'), ('like', 'NONE'), ('nothing', 'NONE'), ('else', 'NONE'), ('e-mu', 'NONE'), ('teaks', 'NONE'), ('are', 'NONE'), ('also', 'NONE'), ('very', 'NONE'), ('good', 'NONE'), ('but', 'NONE'), ('they', 'NONE'), ('boost', 'NONE'), ('the', 'NONE'), ('mids', 'NONE'), ('considerably', 'NONE'), ('at', 'NONE'), ('the', 'NONE'), ('expense', 'NONE'), ('of', 'NONE'), ('some', 'NONE'), ('of', 'NONE'), ('the', 'NONE'), ('bass', 'NONE'), ('speed', 'NONE'), ('decay', 'NONE'), ('and', 'NONE'), ('have', 'NONE'), ('less sharp', 'QLTY'), ('treble', 'NONE')]
As a guitarist who often plays jazz I agree with you There is a lot of possibilities within the world of clean electric guitar tones The examples you gave are perfect I think Metheny s tone is a little more bright and clear more treble or mids I suppose Adam Rogers has got more of the dark warm bassy thing going on depending on the context I like that warm tone but I think some players let it get a tad too muddy for my tastes Anywho the electric guitar by its very nature offers vast timbral possibilities that could be massively useful in that context I imagine it is just a matter of time before we see more of it Hopefully The Los Angeles 8 are a guitar ensemble that plays electric guitars Here is a video of them playing the third movement of Steve Reich s electric counterpoint I get the impression that they are trying to earn the electric guitar some street cred in the realm of concert music The ensemble is different than the context you suggested but it seemed relevant;[('as', 'NONE'), ('a', 'NONE'), ('guitarist', 'NONE'), ('who', 'NONE'), ('often', 'NONE'), ('plays', 'NONE'), ('jazz', 'NONE'), ('i', 'NONE'), ('agree', 'NONE'), ('with', 'NONE'), ('you', 'NONE'), ('there', 'NONE'), ('is', 'NONE'), ('a', 'NONE'), ('lot', 'NONE'), ('of', 'NONE'), ('possibilities', 'NONE'), ('within', 'NONE'), ('the', 'NONE'), ('world', 'NONE'), ('of', 'NONE'), ('clean', 'QLTY'), ('electric guitar', 'INSTR'), ('tones', 'NONE'), ('the', 'NONE'), ('examples', 'NONE'), ('you', 'NONE'), ('gave', 'NONE'), ('are', 'NONE'), ('perfect', 'NONE'), ('i', 'NONE'), ('think', 'NONE'), ('metheny', 'NONE'), ('s', 'NONE'), ('tone', 'NONE'), ('is', 'NONE'), ('a', 'NONE'), ('little', 'NONE'), ('more', 'NONE'), ('bright', 'QLTY'), ('and', 'NONE'), ('clear', 'QLTY'), ('more', 'NONE'), ('treble', 'NONE'), ('or', 'NONE'), ('mids', 'NONE'), ('i', 'NONE'), ('suppose', 'NONE'), ('adam', 'NONE'), ('rogers', 'NONE'), ('has', 'NONE'), ('got', 'NONE'), ('more', 'NONE'), ('of', 'NONE'), ('the', 'NONE'), ('dark', 'QLTY'), ('warm', 'QLTY'), ('bassy', 'QLTY'), ('thing', 'NONE'), ('going', 'NONE'), ('on', 'NONE'), ('depending', 'NONE'), ('on', 'NONE'), ('the', 'NONE'), ('context', 'NONE'), ('i', 'NONE'), ('like', 'NONE'), ('that', 'NONE'), ('warm', 'QLTY'), ('tone', 'NONE'), ('but', 'NONE'), ('i', 'NONE'), ('think', 'NONE'), ('some', 'NONE'), ('players', 'NONE'), ('let', 'NONE'), ('it', 'NONE'), ('get', 'NONE'), ('a', 'NONE'), ('tad', 'NONE'), ('too', 'NONE'), ('muddy', 'QLTY'), ('for', 'NONE'), ('my', 'NONE'), ('tastes', 'NONE'), ('anywho', 'NONE'), ('the', 'NONE'), ('electric guitar', 'INSTR'), ('by', 'NONE'), ('its', 'NONE'), ('very', 'NONE'), ('nature', 'NONE'), ('offers', 'NONE'), ('vast', 'NONE'), ('timbral', 'NONE'), ('possibilities', 'NONE'), ('that', 'NONE'), ('could', 'NONE'), ('be', 'NONE'), ('massively', 'NONE'), ('useful', 'NONE'), ('in', 'NONE'), ('that', 'NONE'), ('context', 'NONE'), ('i', 'NONE'), ('imagine', 'NONE'), ('it', 'NONE'), ('is', 'NONE'), ('just', 'NONE'), ('a', 'NONE'), ('matter', 'NONE'), ('of', 'NONE'), ('time', 'NONE'), ('before', 'NONE'), ('we', 'NONE'), ('see', 'NONE'), ('more', 'NONE'), ('of', 'NONE'), ('it', 'NONE'), ('hopefully', 'NONE'), ('the', 'NONE'), ('los', 'NONE'), ('angeles', 'NONE'), ('8', 'NONE'), ('are', 'NONE'), ('a', 'NONE'), ('guitar', 'INSTR'), ('ensemble', 'NONE'), ('that', 'NONE'), ('plays', 'NONE'), ('electric guitars', 'INSTR'), ('here', 'NONE'), ('is', 'NONE'), ('a', 'NONE'), ('video', 'NONE'), ('of', 'NONE'), ('them', 'NONE'), ('playing', 'NONE'), ('the', 'NONE'), ('third', 'NONE'), ('movement', 'NONE'), ('of', 'NONE'), ('steve', 'NONE'), ('reich', 'NONE'), ('s', 'NONE'), ('electric', 'NONE'), ('counterpoint', 'NONE'), ('i', 'NONE'), ('get', 'NONE'), ('the', 'NONE'), ('impression', 'NONE'), ('that', 'NONE'), ('they', 'NONE'), ('are', 'NONE'), ('trying', 'NONE'), ('to', 'NONE'), ('earn', 'NONE'), ('the', 'NONE'), ('electric guitar', 'INSTR'), ('some', 'NONE'), ('street', 'NONE'), ('cred', 'NONE'), ('in', 'NONE'), ('the', 'NONE'), ('realm', 'NONE'), ('of', 'NONE'), ('concert', 'NONE'), ('music', 'NONE'), ('the', 'NONE'), ('ensemble', 'NONE'), ('is', 'NONE'), ('different', 'NONE'), ('than', 'NONE'), ('the', 'NONE'), ('context', 'NONE'), ('you', 'NONE'), ('suggested', 'NONE'), ('but', 'NONE'), ('it', 'NONE'), ('seemed', 'NONE'), ('relevant', 'NONE')]
One sneaky trick you have for an impressive bass guitar timbre;[('one', 'NONE'), ('sneaky', 'NONE'), ('trick', 'NONE'), ('you', 'NONE'), ('have', 'NONE'), ('for', 'NONE'), ('an', 'NONE'), ('impressive bass', 'QLTY'), ('guitar', 'INSTR'), ('timbre', 'NONE')]
Emo - initially started as emotional hardcore with bands like Rites of Spring Then there was the second wave that had a more mellow style with bands like American Football and Mineral Then there was the third wave where it had its commercial breakthrough and these days when your average person hears the word emo they think of My Chemical Romance Fall Out Boy and Paramore - basically pop rock bands with swoopy haircuts and Hot Topic fashion;[('emo', 'NONE'), ('-', 'NONE'), ('initially', 'NONE'), ('started', 'NONE'), ('as', 'NONE'), ('emotional', 'NONE'), ('hardcore', 'NONE'), ('with', 'NONE'), ('bands', 'NONE'), ('like', 'NONE'), ('rites', 'NONE'), ('of', 'NONE'), ('spring', 'NONE'), ('then', 'NONE'), ('there', 'NONE'), ('was', 'NONE'), ('the', 'NONE'), ('second', 'NONE'), ('wave', 'NONE'), ('that', 'NONE'), ('had', 'NONE'), ('a', 'NONE'), ('more', 'NONE'), ('mellow', 'QLTY'), ('style', 'NONE'), ('with', 'NONE'), ('bands', 'NONE'), ('like', 'NONE'), ('american', 'NONE'), ('football', 'NONE'), ('and', 'NONE'), ('mineral', 'NONE'), ('then', 'NONE'), ('there', 'NONE'), ('was', 'NONE'), ('the', 'NONE'), ('third', 'NONE'), ('wave', 'NONE'), ('where', 'NONE'), ('it', 'NONE'), ('had', 'NONE'), ('its', 'NONE'), ('commercial', 'NONE'), ('breakthrough', 'NONE'), ('and', 'NONE'), ('these', 'NONE'), ('days', 'NONE'), ('when', 'NONE'), ('your', 'NONE'), ('average', 'NONE'), ('person', 'NONE'), ('hears', 'NONE'), ('the', 'NONE'), ('word', 'NONE'), ('emo', 'NONE'), ('they', 'NONE'), ('think', 'NONE'), ('of', 'NONE'), ('my', 'NONE'), ('chemical', 'NONE'), ('romance', 'NONE'), ('fall', 'NONE'), ('out', 'NONE'), ('boy', 'NONE'), ('and', 'NONE'), ('paramore', 'NONE'), ('-', 'NONE'), ('basically', 'NONE'), ('pop', 'NONE'), ('rock', 'NONE'), ('bands', 'NONE'), ('with', 'NONE'), ('swoopy', 'NONE'), ('haircuts', 'NONE'), ('and', 'NONE'), ('hot', 'NONE'), ('topic', 'NONE'), ('fashion', 'NONE')]
Math rock from what I understand It used to refer to music with heavily distorted guitars and a raw sound that incorporated complex drumming and rhythms like polvo Now everybody seems to use it as a synonym for American football knockoffs - that twinkly clean-as-can-be guitar sound that happens to be in weird time signatures;[('math', 'NONE'), ('rock', 'NONE'), ('from', 'NONE'), ('what', 'NONE'), ('i', 'NONE'), ('understand', 'NONE'), ('it', 'NONE'), ('used', 'NONE'), ('to', 'NONE'), ('refer', 'NONE'), ('to', 'NONE'), ('music', 'NONE'), ('with', 'NONE'), ('heavily distorted', 'QLTY'), ('guitars', 'INSTR'), ('and', 'NONE'), ('a', 'NONE'), ('raw', 'NONE'), ('sound', 'NONE'), ('that', 'NONE'), ('incorporated', 'NONE'), ('complex', 'NONE'), ('drumming', 'NONE'), ('and', 'NONE'), ('rhythms', 'NONE'), ('like', 'NONE'), ('polvo', 'NONE'), ('now', 'NONE'), ('everybody', 'NONE'), ('seems', 'NONE'), ('to', 'NONE'), ('use', 'NONE'), ('it', 'NONE'), ('as', 'NONE'), ('a', 'NONE'), ('synonym', 'NONE'), ('for', 'NONE'), ('american', 'NONE'), ('football', 'NONE'), ('knockoffs', 'NONE'), ('-', 'NONE'), ('that', 'NONE'), ('twinkly', 'NONE'), ('clean-as-can-be', 'NONE'), ('guitar', 'INSTR'), ('sound', 'NONE'), ('that', 'NONE'), ('happens', 'NONE'), ('to', 'NONE'), ('be', 'NONE'), ('in', 'NONE'), ('weird', 'NONE'), ('time', 'NONE'), ('signatures', 'NONE')]
Post rock used to be a lot broader described bands with quite different sounds like Slint Tortoise or Talk Talk Feels like now it is more narrow bands tend to sound like EITS clones with that chiming guitar sound and big crescendos;[('post', 'NONE'), ('rock', 'NONE'), ('used', 'NONE'), ('to', 'NONE'), ('be', 'NONE'), ('a', 'NONE'), ('lot', 'NONE'), ('broader', 'NONE'), ('described', 'NONE'), ('bands', 'NONE'), ('with', 'NONE'), ('quite', 'NONE'), ('different', 'NONE'), ('sounds', 'NONE'), ('like', 'NONE'), ('slint', 'NONE'), ('tortoise', 'NONE'), ('or', 'NONE'), ('talk', 'NONE'), ('talk', 'NONE'), ('feels', 'NONE'), ('like', 'NONE'), ('now', 'NONE'), ('it', 'NONE'), ('is', 'NONE'), ('more', 'NONE'), ('narrow', 'NONE'), ('bands', 'NONE'), ('tend', 'NONE'), ('to', 'NONE'), ('sound', 'NONE'), ('like', 'NONE'), ('eits', 'NONE'), ('clones', 'NONE'), ('with', 'NONE'), ('that', 'NONE'), ('chiming', 'QLTY'), ('guitar', 'INSTR'), ('sound', 'NONE'), ('and', 'NONE'), ('big', 'NONE'), ('crescendos', 'NONE')]
Is learning to sing more like learning to swim losing weight than learning the piano guitar Does it take years to develop the vocal cord for wider vocal range fuller richer tone and timbre;[('is', 'NONE'), ('learning', 'NONE'), ('to', 'NONE'), ('sing', 'NONE'), ('more', 'NONE'), ('like', 'NONE'), ('learning', 'NONE'), ('to', 'NONE'), ('swim', 'NONE'), ('losing', 'NONE'), ('weight', 'NONE'), ('than', 'NONE'), ('learning', 'NONE'), ('the', 'NONE'), ('piano', 'INSTR'), ('guitar', 'INSTR'), ('does', 'NONE'), ('it', 'NONE'), ('take', 'NONE'), ('years', 'NONE'), ('to', 'NONE'), ('develop', 'NONE'), ('the', 'NONE'), ('vocal', 'NONE'), ('cord', 'NONE'), ('for', 'NONE'), ('wider', 'NONE'), ('vocal', 'NONE'), ('range', 'NONE'), ('fuller', 'QLTY'), ('richer', 'QLTY'), ('tone', 'NONE'), ('and', 'NONE'), ('timbre', 'NONE')]
We do have many terms that spectrally mean something but because of an average lack of understanding about complex spectral analysis were left with words like metallic dull dark percussive bright sharp soft etc some timbre words often overlap with dynamic specifications like soft for example that could possibly mean quiet but also imply a method of playing or timbre These I believe are the problem areas that should better be explained Really the problem is language and culture as the culture of historical language in music has evolved to imply more meaning than the words themselves Likely the evolution of language in music will continue to progress towards specific terminology as composers usage of the terms become more detailed and less traditional However it 2019s also likely that it will continue to stay the same for the sake of preserving historical context It 2019s definitely an interesting topic and proves that the language within music is its own culture and is constantly evolving What you are explaining however is not a word for timbre it is a word for technique;[('we', 'NONE'), ('do', 'NONE'), ('have', 'NONE'), ('many', 'NONE'), ('terms', 'NONE'), ('that', 'NONE'), ('spectrally', 'NONE'), ('mean', 'NONE'), ('something', 'NONE'), ('but', 'NONE'), ('because', 'NONE'), ('of', 'NONE'), ('an', 'NONE'), ('average', 'NONE'), ('lack', 'NONE'), ('of', 'NONE'), ('understanding', 'NONE'), ('about', 'NONE'), ('complex', 'NONE'), ('spectral', 'NONE'), ('analysis', 'NONE'), ('were', 'NONE'), ('left', 'NONE'), ('with', 'NONE'), ('words', 'NONE'), ('like', 'NONE'), ('metallic', 'QLTY'), ('dull', 'QLTY'), ('dark', 'QLTY'), ('percussive', 'QLTY'), ('bright', 'QLTY'), ('sharp', 'QLTY'), ('soft', 'QLTY'), ('etc', 'NONE'), ('some', 'NONE'), ('timbre', 'NONE'), ('words', 'NONE'), ('often', 'NONE'), ('overlap', 'NONE'), ('with', 'NONE'), ('dynamic', 'NONE'), ('specifications', 'NONE'), ('like', 'NONE'), ('soft', 'QLTY'), ('for', 'NONE'), ('example', 'NONE'), ('that', 'NONE'), ('could', 'NONE'), ('possibly', 'NONE'), ('mean', 'NONE'), ('quiet', 'NONE'), ('but', 'NONE'), ('also', 'NONE'), ('imply', 'NONE'), ('a', 'NONE'), ('method', 'NONE'), ('of', 'NONE'), ('playing', 'NONE'), ('or', 'NONE'), ('timbre', 'NONE'), ('these', 'NONE'), ('i', 'NONE'), ('believe', 'NONE'), ('are', 'NONE'), ('the', 'NONE'), ('problem', 'NONE'), ('areas', 'NONE'), ('that', 'NONE'), ('should', 'NONE'), ('better', 'NONE'), ('be', 'NONE'), ('explained', 'NONE'), ('really', 'NONE'), ('the', 'NONE'), ('problem', 'NONE'), ('is', 'NONE'), ('language', 'NONE'), ('and', 'NONE'), ('culture', 'NONE'), ('as', 'NONE'), ('the', 'NONE'), ('culture', 'NONE'), ('of', 'NONE'), ('historical', 'NONE'), ('language', 'NONE'), ('in', 'NONE'), ('music', 'NONE'), ('has', 'NONE'), ('evolved', 'NONE'), ('to', 'NONE'), ('imply', 'NONE'), ('more', 'NONE'), ('meaning', 'NONE'), ('than', 'NONE'), ('the', 'NONE'), ('words', 'NONE'), ('themselves', 'NONE'), ('likely', 'NONE'), ('the', 'NONE'), ('evolution', 'NONE'), ('of', 'NONE'), ('language', 'NONE'), ('in', 'NONE'), ('music', 'NONE'), ('will', 'NONE'), ('continue', 'NONE'), ('to', 'NONE'), ('progress', 'NONE'), ('towards', 'NONE'), ('specific', 'NONE'), ('terminology', 'NONE'), ('as', 'NONE'), ('composers', 'NONE'), ('usage', 'NONE'), ('of', 'NONE'), ('the', 'NONE'), ('terms', 'NONE'), ('become', 'NONE'), ('more', 'NONE'), ('detailed', 'NONE'), ('and', 'NONE'), ('less', 'NONE'), ('traditional', 'NONE'), ('however', 'NONE'), ('it', 'NONE'), ('2019s', 'NONE'), ('also', 'NONE'), ('likely', 'NONE'), ('that', 'NONE'), ('it', 'NONE'), ('will', 'NONE'), ('continue', 'NONE'), ('to', 'NONE'), ('stay', 'NONE'), ('the', 'NONE'), ('same', 'NONE'), ('for', 'NONE'), ('the', 'NONE'), ('sake', 'NONE'), ('of', 'NONE'), ('preserving', 'NONE'), ('historical', 'NONE'), ('context', 'NONE'), ('it', 'NONE'), ('2019s', 'NONE'), ('definitely', 'NONE'), ('an', 'NONE'), ('interesting', 'NONE'), ('topic', 'NONE'), ('and', 'NONE'), ('proves', 'NONE'), ('that', 'NONE'), ('the', 'NONE'), ('language', 'NONE'), ('within', 'NONE'), ('music', 'NONE'), ('is', 'NONE'), ('its', 'NONE'), ('own', 'NONE'), ('culture', 'NONE'), ('and', 'NONE'), ('is', 'NONE'), ('constantly', 'NONE'), ('evolving', 'NONE'), ('what', 'NONE'), ('you', 'NONE'), ('are', 'NONE'), ('explaining', 'NONE'), ('however', 'NONE'), ('is', 'NONE'), ('not', 'NONE'), ('a', 'NONE'), ('word', 'NONE'), ('for', 'NONE'), ('timbre', 'NONE'), ('it', 'NONE'), ('is', 'NONE'), ('a', 'NONE'), ('word', 'NONE'), ('for', 'NONE'), ('technique', 'NONE')]
I had the same issue question for a while lol I think what helped me is realizing that the random elements make up the chord a lot of the times Like the sub might be a G and the lead sound might be a D and the weird glitchy sounds might be a B or alternate between them And all together you have a G chord even if it doesn 2019t necessarily sound like it Hope that makes sense;[('i', 'NONE'), ('had', 'NONE'), ('the', 'NONE'), ('same', 'NONE'), ('issue', 'NONE'), ('question', 'NONE'), ('for', 'NONE'), ('a', 'NONE'), ('while', 'NONE'), ('lol', 'NONE'), ('i', 'NONE'), ('think', 'NONE'), ('what', 'NONE'), ('helped', 'NONE'), ('me', 'NONE'), ('is', 'NONE'), ('realizing', 'NONE'), ('that', 'NONE'), ('the', 'NONE'), ('random', 'NONE'), ('elements', 'NONE'), ('make', 'NONE'), ('up', 'NONE'), ('the', 'NONE'), ('chord', 'NONE'), ('a', 'NONE'), ('lot', 'NONE'), ('of', 'NONE'), ('the', 'NONE'), ('times', 'NONE'), ('like', 'NONE'), ('the', 'NONE'), ('sub', 'NONE'), ('might', 'NONE'), ('be', 'NONE'), ('a', 'NONE'), ('g', 'NONE'), ('and', 'NONE'), ('the', 'NONE'), ('lead', 'NONE'), ('sound', 'NONE'), ('might', 'NONE'), ('be', 'NONE'), ('a', 'NONE'), ('d', 'NONE'), ('and', 'NONE'), ('the', 'NONE'), ('weird', 'NONE'), ('glitchy', 'QLTY'), ('sounds', 'NONE'), ('might', 'NONE'), ('be', 'NONE'), ('a', 'NONE'), ('b', 'NONE'), ('or', 'NONE'), ('alternate', 'NONE'), ('between', 'NONE'), ('them', 'NONE'), ('and', 'NONE'), ('all', 'NONE'), ('together', 'NONE'), ('you', 'NONE'), ('have', 'NONE'), ('a', 'NONE'), ('g', 'NONE'), ('chord', 'NONE'), ('even', 'NONE'), ('if', 'NONE'), ('it', 'NONE'), ('doesn', 'NONE'), ('2019t', 'NONE'), ('necessarily', 'NONE'), ('sound', 'NONE'), ('like', 'NONE'), ('it', 'NONE'), ('hope', 'NONE'), ('that', 'NONE'), ('makes', 'NONE'), ('sense', 'NONE')]
